[
  {
    "id": 122,
    "bool_col": true,
    "tinyint_col": 2,
    "smallint_col": 2,
    "int_col": 2,
    "bigint_col": 20,
    "float_col": 2.200000047683716,
    "double_col": 20.2,
    "date_string_col": "01/13/09",
    "string_col": "2",
    "timestamp_col": "2009-01-13 01:02:05.410000",
    "year": 2009,
    "month": 1
  },
  {
    "id": 123,
    "bool_col": false,
    "tinyint_col": 3,
    "smallint_col": 3,
    "int_col": 3,
    "bigint_col": 30,
    "float_col": 3.299999952316284,
    "double_col": 30.299999999999997,
    "date_string_col": "01/13/09",
    "string_col": "3",
    "timestamp_col": "2009-01-13 01:03:05.430000",
    "year": 2009,
    "month": 1
  },
  {
    "id": 124,
    "bool_col": true,
    "tinyint_col": 4,
    "smallint_col": 4,
    "int_col": 4,
    "bigint_col": 40,
    "float_col": 4.400000095367432,
    "double_col": 40.4,
    "date_string_col": "01/13/09",
    "string_col": "4",
    "timestamp_col": "2009-01-13 01:04:05.460000",
    "year": 2009,
    "month": 1
  },
  {
    "id": 125,
    "bool_col": false,
    "tinyint_col": 5,
    "smallint_col": 5,
    "int_col": 5,
    "bigint_col": 50,
    "float_col": 5.5,
    "double_col": 50.5,
    "date_string_col": "01/13/09",
    "string_col": "5",
    "timestamp_col": "2009-01-13 01:05:05.500000",
    "year": 2009,
    "month": 1
  },
  {
    "id": 126,
    "bool_col": true,
    "tinyint_col": 6,
    "smallint_col": 6,
    "int_col": 6,
    "bigint_col": 60,
    "float_col": 6.599999904632568,
    "double_col": 60.599999999999994,
    "date_string_col": "01/13/09",
    "string_col": "6",
    "timestamp_col": "2009-01-13 01:06:05.550000",
    "year": 2009,
    "month": 1
  },
  {
    "id": 127,
    "bool_col": false,
    "tinyint_col": 7,
    "smallint_col": 7,
    "int_col": 7,
    "bigint_col": 70,
    "float_col": 7.699999809265137,
    "double_col": 70.7,
    "date_string_col": "01/13/09",
    "string_col": "7",
    "timestamp_col": "2009-01-13 01:07:05.610000",
    "year": 2009,
    "month": 1
  },
  {
    "id": 128,
    "bool_col": true,
    "tinyint_col": 8,
    "smallint_col": 8,
    "int_col": 8,
    "bigint_col": 80,
    "float_col": 8.800000190734863,
    "double_col": 80.8,
    "date_string_col": "01/13/09",
    "string_col": "8",
    "timestamp_col": "2009-01-13 01:08:05.680000",
    "year": 2009,
    "month": 1
  },
  {
    "id": 129,
    "bool_col": false,
    "tinyint_col": 9,
    "smallint_col": 9,
    "int_col": 9,
    "bigint_col": 90,
    "float_col": 9.899999618530273,
    "double_col": 90.89999999999999,
    "date_string_col": "01/13/09",
    "string_col": "9",
    "timestamp_col": "2009-01-13 01:09:05.760000",
    "year": 2009,
    "month": 1
  },
  {
    "id": 130,
    "bool_col": true,
    "tinyint_col": 0,
    "smallint_col": 0,
    "int_col": 0,
    "bigint_col": 0,
    "float_col": 0.0,
    "double_col": 0.0,
    "date_string_col": "01/14/09",
    "string_col": "0",
    "timestamp_col": "2009-01-14 01:10:05.850000",
    "year": 2009,
    "month": 1
  },
  {
    "id": 131,
    "bool_col": false,
    "tinyint_col": 1,
    "smallint_col": 1,
    "int_col": 1,
    "bigint_col": 10,
    "float_col": 1.100000023841858,
    "double_col": 10.1,
    "date_string_col": "01/14/09",
    "string_col": "1",
    "timestamp_col": "2009-01-14 01:11:05.850000",
    "year": 2009,
    "month": 1
  },
  {
    "id": 132,
    "bool_col": true,
    "tinyint_col": 2,
    "smallint_col": 2,
    "int_col": 2,
    "bigint_col": 20,
    "float_col": 2.200000047683716,
    "double_col": 20.2,
    "date_string_col": "01/14/09",
    "string_col": "2",
    "timestamp_col": "2009-01-14 01:12:05.860000",
    "year": 2009,
    "month": 1
  },
  {
    "id": 133,
    "bool_col": false,
    "tinyint_col": 3,
    "smallint_col": 3,
    "int_col": 3,
    "bigint_col": 30,
    "float_col": 3.299999952316284,
    "double_col": 30.299999999999997,
    "date_string_col": "01/14/09",
    "string_col": "3",
    "timestamp_col": "2009-01-14 01:13:05.880000",
    "year": 2009,
    "month": 1
  },
  {
    "id": 134,
    "bool_col": true,
    "tinyint_col": 4,
    "smallint_col": 4,
    "int_col": 4,
    "bigint_col": 40,
    "float_col": 4.400000095367432,
    "double_col": 40.4,
    "date_string_col": "01/14/09",
    "string_col": "4",
    "timestamp_col": "2009-01-14 01:14:05.910000",
    "year": 2009,
    "month": 1
  },
  {
    "id": 135,
    "bool_col": false,
    "tinyint_col": 5,
    "smallint_col": 5,
    "int_col": 5,
    "bigint_col": 50,
    "float_col": 5.5,
    "double_col": 50.5,
    "date_string_col": "01/14/09",
    "string_col": "5",
    "timestamp_col": "2009-01-14 01:15:05.950000",
    "year": 2009,
    "month": 1
  },
  {
    "id": 136,
    "bool_col": true,
    "tinyint_col": 6,
    "smallint_col": 6,
    "int_col": 6,
    "bigint_col": 60,
    "float_col": 6.599999904632568,
    "double_col": 60.599999999999994,
    "date_string_col": "01/14/09",
    "string_col": "6",
    "timestamp_col": "2009-01-14 01:16:06",
    "year": 2009,
    "month": 1
  },
  {
    "id": 137,
    "bool_col": false,
    "tinyint_col": 7,
    "smallint_col": 7,
    "int_col": 7,
    "bigint_col": 70,
    "float_col": 7.699999809265137,
    "double_col": 70.7,
    "date_string_col": "01/14/09",
    "string_col": "7",
    "timestamp_col": "2009-01-14 01:17:06.600000",
    "year": 2009,
    "month": 1
  },
  {
    "id": 138,
    "bool_col": true,
    "tinyint_col": 8,
    "smallint_col": 8,
    "int_col": 8,
    "bigint_col": 80,
    "float_col": 8.800000190734863,
    "double_col": 80.8,
    "date_string_col": "01/14/09",
    "string_col": "8",
    "timestamp_col": "2009-01-14 01:18:06.130000",
    "year": 2009,
    "month": 1
  },
  {
    "id": 139,
    "bool_col": false,
    "tinyint_col": 9,
    "smallint_col": 9,
    "int_col": 9,
    "bigint_col": 90,
    "float_col": 9.899999618530273,
    "double_col": 90.89999999999999,
    "date_string_col": "01/14/09",
    "string_col": "9",
    "timestamp_col": "2009-01-14 01:19:06.210000",
    "year": 2009,
    "month": 1
  },
  {
    "id": 140,
    "bool_col": true,
    "tinyint_col": 0,
    "smallint_col": 0,
    "int_col": 0,
    "bigint_col": 0,
    "float_col": 0.0,
    "double_col": 0.0,
    "date_string_col": "01/15/09",
    "string_col": "0",
    "timestamp_col": "2009-01-15 01:20:06.300000",
    "year": 2009,
    "month": 1
  },
  {
    "id": 141,
    "bool_col": false,
    "tinyint_col": 1,
    "smallint_col": 1,
    "int_col": 1,
    "bigint_col": 10,
    "float_col": 1.100000023841858,
    "double_col": 10.1,
    "date_string_col": "01/15/09",
    "string_col": "1",
    "timestamp_col": "2009-01-15 01:21:06.300000",
    "year": 2009,
    "month": 1
  },
  {
    "id": 142,
    "bool_col": true,
    "tinyint_col": 2,
    "smallint_col": 2,
    "int_col": 2,
    "bigint_col": 20,
    "float_col": 2.200000047683716,
    "double_col": 20.2,
    "date_string_col": "01/15/09",
    "string_col": "2",
    "timestamp_col": "2009-01-15 01:22:06.310000",
    "year": 2009,
    "month": 1
  },
  {
    "id": 143,
    "bool_col": false,
    "tinyint_col": 3,
    "smallint_col": 3,
    "int_col": 3,
    "bigint_col": 30,
    "float_col": 3.299999952316284,
    "double_col": 30.299999999999997,
    "date_string_col": "01/15/09",
    "string_col": "3",
    "timestamp_col": "2009-01-15 01:23:06.330000",
    "year": 2009,
    "month": 1
  },
  {
    "id": 144,
    "bool_col": true,
    "tinyint_col": 4,
    "smallint_col": 4,
    "int_col": 4,
    "bigint_col": 40,
    "float_col": 4.400000095367432,
    "double_col": 40.4,
    "date_string_col": "01/15/09",
    "string_col": "4",
    "timestamp_col": "2009-01-15 01:24:06.360000",
    "year": 2009,
    "month": 1
  },
  {
    "id": 145,
    "bool_col": false,
    "tinyint_col": 5,
    "smallint_col": 5,
    "int_col": 5,
    "bigint_col": 50,
    "float_col": 5.5,
    "double_col": 50.5,
    "date_string_col": "01/15/09",
    "string_col": "5",
    "timestamp_col": "2009-01-15 01:25:06.400000",
    "year": 2009,
    "month": 1
  },
  {
    "id": 98,
    "bool_col": true,
    "tinyint_col": 8,
    "smallint_col": 8,
    "int_col": 8,
    "bigint_col": 80,
    "float_col": 8.800000190734863,
    "double_col": 80.8,
    "date_string_col": "01/10/09",
    "string_col": "8",
    "timestamp_col": "2009-01-10 00:38:04.330000",
    "year": 2009,
    "month": 1
  },
  {
    "id": 99,
    "bool_col": false,
    "tinyint_col": 9,
    "smallint_col": 9,
    "int_col": 9,
    "bigint_col": 90,
    "float_col": 9.899999618530273,
    "double_col": 90.89999999999999,
    "date_string_col": "01/10/09",
    "string_col": "9",
    "timestamp_col": "2009-01-10 00:39:04.410000",
    "year": 2009,
    "month": 1
  },
  {
    "id": 100,
    "bool_col": true,
    "tinyint_col": 0,
    "smallint_col": 0,
    "int_col": 0,
    "bigint_col": 0,
    "float_col": 0.0,
    "double_col": 0.0,
    "date_string_col": "01/11/09",
    "string_col": "0",
    "timestamp_col": "2009-01-11 00:40:04.500000",
    "year": 2009,
    "month": 1
  },
  {
    "id": 101,
    "bool_col": false,
    "tinyint_col": 1,
    "smallint_col": 1,
    "int_col": 1,
    "bigint_col": 10,
    "float_col": 1.100000023841858,
    "double_col": 10.1,
    "date_string_col": "01/11/09",
    "string_col": "1",
    "timestamp_col": "2009-01-11 00:41:04.500000",
    "year": 2009,
    "month": 1
  },
  {
    "id": 102,
    "bool_col": true,
    "tinyint_col": 2,
    "smallint_col": 2,
    "int_col": 2,
    "bigint_col": 20,
    "float_col": 2.200000047683716,
    "double_col": 20.2,
    "date_string_col": "01/11/09",
    "string_col": "2",
    "timestamp_col": "2009-01-11 00:42:04.510000",
    "year": 2009,
    "month": 1
  },
  {
    "id": 103,
    "bool_col": false,
    "tinyint_col": 3,
    "smallint_col": 3,
    "int_col": 3,
    "bigint_col": 30,
    "float_col": 3.299999952316284,
    "double_col": 30.299999999999997,
    "date_string_col": "01/11/09",
    "string_col": "3",
    "timestamp_col": "2009-01-11 00:43:04.530000",
    "year": 2009,
    "month": 1
  },
  {
    "id": 104,
    "bool_col": true,
    "tinyint_col": 4,
    "smallint_col": 4,
    "int_col": 4,
    "bigint_col": 40,
    "float_col": 4.400000095367432,
    "double_col": 40.4,
    "date_string_col": "01/11/09",
    "string_col": "4",
    "timestamp_col": "2009-01-11 00:44:04.560000",
    "year": 2009,
    "month": 1
  },
  {
    "id": 105,
    "bool_col": false,
    "tinyint_col": 5,
    "smallint_col": 5,
    "int_col": 5,
    "bigint_col": 50,
    "float_col": 5.5,
    "double_col": 50.5,
    "date_string_col": "01/11/09",
    "string_col": "5",
    "timestamp_col": "2009-01-11 00:45:04.600000",
    "year": 2009,
    "month": 1
  },
  {
    "id": 106,
    "bool_col": true,
    "tinyint_col": 6,
    "smallint_col": 6,
    "int_col": 6,
    "bigint_col": 60,
    "float_col": 6.599999904632568,
    "double_col": 60.599999999999994,
    "date_string_col": "01/11/09",
    "string_col": "6",
    "timestamp_col": "2009-01-11 00:46:04.650000",
    "year": 2009,
    "month": 1
  },
  {
    "id": 107,
    "bool_col": false,
    "tinyint_col": 7,
    "smallint_col": 7,
    "int_col": 7,
    "bigint_col": 70,
    "float_col": 7.699999809265137,
    "double_col": 70.7,
    "date_string_col": "01/11/09",
    "string_col": "7",
    "timestamp_col": "2009-01-11 00:47:04.710000",
    "year": 2009,
    "month": 1
  },
  {
    "id": 108,
    "bool_col": true,
    "tinyint_col": 8,
    "smallint_col": 8,
    "int_col": 8,
    "bigint_col": 80,
    "float_col": 8.800000190734863,
    "double_col": 80.8,
    "date_string_col": "01/11/09",
    "string_col": "8",
    "timestamp_col": "2009-01-11 00:48:04.780000",
    "year": 2009,
    "month": 1
  },
  {
    "id": 109,
    "bool_col": false,
    "tinyint_col": 9,
    "smallint_col": 9,
    "int_col": 9,
    "bigint_col": 90,
    "float_col": 9.899999618530273,
    "double_col": 90.89999999999999,
    "date_string_col": "01/11/09",
    "string_col": "9",
    "timestamp_col": "2009-01-11 00:49:04.860000",
    "year": 2009,
    "month": 1
  },
  {
    "id": 110,
    "bool_col": true,
    "tinyint_col": 0,
    "smallint_col": 0,
    "int_col": 0,
    "bigint_col": 0,
    "float_col": 0.0,
    "double_col": 0.0,
    "date_string_col": "01/12/09",
    "string_col": "0",
    "timestamp_col": "2009-01-12 00:50:04.950000",
    "year": 2009,
    "month": 1
  },
  {
    "id": 111,
    "bool_col": false,
    "tinyint_col": 1,
    "smallint_col": 1,
    "int_col": 1,
    "bigint_col": 10,
    "float_col": 1.100000023841858,
    "double_col": 10.1,
    "date_string_col": "01/12/09",
    "string_col": "1",
    "timestamp_col": "2009-01-12 00:51:04.950000",
    "year": 2009,
    "month": 1
  },
  {
    "id": 112,
    "bool_col": true,
    "tinyint_col": 2,
    "smallint_col": 2,
    "int_col": 2,
    "bigint_col": 20,
    "float_col": 2.200000047683716,
    "double_col": 20.2,
    "date_string_col": "01/12/09",
    "string_col": "2",
    "timestamp_col": "2009-01-12 00:52:04.960000",
    "year": 2009,
    "month": 1
  },
  {
    "id": 113,
    "bool_col": false,
    "tinyint_col": 3,
    "smallint_col": 3,
    "int_col": 3,
    "bigint_col": 30,
    "float_col": 3.299999952316284,
    "double_col": 30.299999999999997,
    "date_string_col": "01/12/09",
    "string_col": "3",
    "timestamp_col": "2009-01-12 00:53:04.980000",
    "year": 2009,
    "month": 1
  },
  {
    "id": 114,
    "bool_col": true,
    "tinyint_col": 4,
    "smallint_col": 4,
    "int_col": 4,
    "bigint_col": 40,
    "float_col": 4.400000095367432,
    "double_col": 40.4,
    "date_string_col": "01/12/09",
    "string_col": "4",
    "timestamp_col": "2009-01-12 00:54:05.100000",
    "year": 2009,
    "month": 1
  },
  {
    "id": 115,
    "bool_col": false,
    "tinyint_col": 5,
    "smallint_col": 5,
    "int_col": 5,
    "bigint_col": 50,
    "float_col": 5.5,
    "double_col": 50.5,
    "date_string_col": "01/12/09",
    "string_col": "5",
    "timestamp_col": "2009-01-12 00:55:05.500000",
    "year": 2009,
    "month": 1
  },
  {
    "id": 116,
    "bool_col": true,
    "tinyint_col": 6,
    "smallint_col": 6,
    "int_col": 6,
    "bigint_col": 60,
    "float_col": 6.599999904632568,
    "double_col": 60.599999999999994,
    "date_string_col": "01/12/09",
    "string_col": "6",
    "timestamp_col": "2009-01-12 00:56:05.100000",
    "year": 2009,
    "month": 1
  },
  {
    "id": 117,
    "bool_col": false,
    "tinyint_col": 7,
    "smallint_col": 7,
    "int_col": 7,
    "bigint_col": 70,
    "float_col": 7.699999809265137,
    "double_col": 70.7,
    "date_string_col": "01/12/09",
    "string_col": "7",
    "timestamp_col": "2009-01-12 00:57:05.160000",
    "year": 2009,
    "month": 1
  },
  {
    "id": 118,
    "bool_col": true,
    "tinyint_col": 8,
    "smallint_col": 8,
    "int_col": 8,
    "bigint_col": 80,
    "float_col": 8.800000190734863,
    "double_col": 80.8,
    "date_string_col": "01/12/09",
    "string_col": "8",
    "timestamp_col": "2009-01-12 00:58:05.230000",
    "year": 2009,
    "month": 1
  },
  {
    "id": 119,
    "bool_col": false,
    "tinyint_col": 9,
    "smallint_col": 9,
    "int_col": 9,
    "bigint_col": 90,
    "float_col": 9.899999618530273,
    "double_col": 90.89999999999999,
    "date_string_col": "01/12/09",
    "string_col": "9",
    "timestamp_col": "2009-01-12 00:59:05.310000",
    "year": 2009,
    "month": 1
  },
  {
    "id": 120,
    "bool_col": true,
    "tinyint_col": 0,
    "smallint_col": 0,
    "int_col": 0,
    "bigint_col": 0,
    "float_col": 0.0,
    "double_col": 0.0,
    "date_string_col": "01/13/09",
    "string_col": "0",
    "timestamp_col": "2009-01-13 01:00:05.400000",
    "year": 2009,
    "month": 1
  },
  {
    "id": 121,
    "bool_col": false,
    "tinyint_col": 1,
    "smallint_col": 1,
    "int_col": 1,
    "bigint_col": 10,
    "float_col": 1.100000023841858,
    "double_col": 10.1,
    "date_string_col": "01/13/09",
    "string_col": "1",
    "timestamp_col": "2009-01-13 01:01:05.400000",
    "year": 2009,
    "month": 1
  },
  {
    "id": 171,
    "bool_col": false,
    "tinyint_col": 1,
    "smallint_col": 1,
    "int_col": 1,
    "bigint_col": 10,
    "float_col": 1.100000023841858,
    "double_col": 10.1,
    "date_string_col": "01/18/09",
    "string_col": "1",
    "timestamp_col": "2009-01-18 01:51:07.650000",
    "year": 2009,
    "month": 1
  },
  {
    "id": 172,
    "bool_col": true,
    "tinyint_col": 2,
    "smallint_col": 2,
    "int_col": 2,
    "bigint_col": 20,
    "float_col": 2.200000047683716,
    "double_col": 20.2,
    "date_string_col": "01/18/09",
    "string_col": "2",
    "timestamp_col": "2009-01-18 01:52:07.660000",
    "year": 2009,
    "month": 1
  },
  {
    "id": 173,
    "bool_col": false,
    "tinyint_col": 3,
    "smallint_col": 3,
    "int_col": 3,
    "bigint_col": 30,
    "float_col": 3.299999952316284,
    "double_col": 30.299999999999997,
    "date_string_col": "01/18/09",
    "string_col": "3",
    "timestamp_col": "2009-01-18 01:53:07.680000",
    "year": 2009,
    "month": 1
  },
  {
    "id": 174,
    "bool_col": true,
    "tinyint_col": 4,
    "smallint_col": 4,
    "int_col": 4,
    "bigint_col": 40,
    "float_col": 4.400000095367432,
    "double_col": 40.4,
    "date_string_col": "01/18/09",
    "string_col": "4",
    "timestamp_col": "2009-01-18 01:54:07.710000",
    "year": 2009,
    "month": 1
  },
  {
    "id": 175,
    "bool_col": false,
    "tinyint_col": 5,
    "smallint_col": 5,
    "int_col": 5,
    "bigint_col": 50,
    "float_col": 5.5,
    "double_col": 50.5,
    "date_string_col": "01/18/09",
    "string_col": "5",
    "timestamp_col": "2009-01-18 01:55:07.750000",
    "year": 2009,
    "month": 1
  },
  {
    "id": 176,
    "bool_col": true,
    "tinyint_col": 6,
    "smallint_col": 6,
    "int_col": 6,
    "bigint_col": 60,
    "float_col": 6.599999904632568,
    "double_col": 60.599999999999994,
    "date_string_col": "01/18/09",
    "string_col": "6",
    "timestamp_col": "2009-01-18 01:56:07.800000",
    "year": 2009,
    "month": 1
  },
  {
    "id": 177,
    "bool_col": false,
    "tinyint_col": 7,
    "smallint_col": 7,
    "int_col": 7,
    "bigint_col": 70,
    "float_col": 7.699999809265137,
    "double_col": 70.7,
    "date_string_col": "01/18/09",
    "string_col": "7",
    "timestamp_col": "2009-01-18 01:57:07.860000",
    "year": 2009,
    "month": 1
  },
  {
    "id": 178,
    "bool_col": true,
    "tinyint_col": 8,
    "smallint_col": 8,
    "int_col": 8,
    "bigint_col": 80,
    "float_col": 8.800000190734863,
    "double_col": 80.8,
    "date_string_col": "01/18/09",
    "string_col": "8",
    "timestamp_col": "2009-01-18 01:58:07.930000",
    "year": 2009,
    "month": 1
  },
  {
    "id": 179,
    "bool_col": false,
    "tinyint_col": 9,
    "smallint_col": 9,
    "int_col": 9,
    "bigint_col": 90,
    "float_col": 9.899999618530273,
    "double_col": 90.89999999999999,
    "date_string_col": "01/18/09",
    "string_col": "9",
    "timestamp_col": "2009-01-18 01:59:08.100000",
    "year": 2009,
    "month": 1
  },
  {
    "id": 180,
    "bool_col": true,
    "tinyint_col": 0,
    "smallint_col": 0,
    "int_col": 0,
    "bigint_col": 0,
    "float_col": 0.0,
    "double_col": 0.0,
    "date_string_col": "01/19/09",
    "string_col": "0",
    "timestamp_col": "2009-01-19 02:00:08.100000",
    "year": 2009,
    "month": 1
  },
  {
    "id": 181,
    "bool_col": false,
    "tinyint_col": 1,
    "smallint_col": 1,
    "int_col": 1,
    "bigint_col": 10,
    "float_col": 1.100000023841858,
    "double_col": 10.1,
    "date_string_col": "01/19/09",
    "string_col": "1",
    "timestamp_col": "2009-01-19 02:01:08.100000",
    "year": 2009,
    "month": 1
  },
  {
    "id": 182,
    "bool_col": true,
    "tinyint_col": 2,
    "smallint_col": 2,
    "int_col": 2,
    "bigint_col": 20,
    "float_col": 2.200000047683716,
    "double_col": 20.2,
    "date_string_col": "01/19/09",
    "string_col": "2",
    "timestamp_col": "2009-01-19 02:02:08.110000",
    "year": 2009,
    "month": 1
  },
  {
    "id": 183,
    "bool_col": false,
    "tinyint_col": 3,
    "smallint_col": 3,
    "int_col": 3,
    "bigint_col": 30,
    "float_col": 3.299999952316284,
    "double_col": 30.299999999999997,
    "date_string_col": "01/19/09",
    "string_col": "3",
    "timestamp_col": "2009-01-19 02:03:08.130000",
    "year": 2009,
    "month": 1
  },
  {
    "id": 184,
    "bool_col": true,
    "tinyint_col": 4,
    "smallint_col": 4,
    "int_col": 4,
    "bigint_col": 40,
    "float_col": 4.400000095367432,
    "double_col": 40.4,
    "date_string_col": "01/19/09",
    "string_col": "4",
    "timestamp_col": "2009-01-19 02:04:08.160000",
    "year": 2009,
    "month": 1
  },
  {
    "id": 185,
    "bool_col": false,
    "tinyint_col": 5,
    "smallint_col": 5,
    "int_col": 5,
    "bigint_col": 50,
    "float_col": 5.5,
    "double_col": 50.5,
    "date_string_col": "01/19/09",
    "string_col": "5",
    "timestamp_col": "2009-01-19 02:05:08.200000",
    "year": 2009,
    "month": 1
  },
  {
    "id": 186,
    "bool_col": true,
    "tinyint_col": 6,
    "smallint_col": 6,
    "int_col": 6,
    "bigint_col": 60,
    "float_col": 6.599999904632568,
    "double_col": 60.599999999999994,
    "date_string_col": "01/19/09",
    "string_col": "6",
    "timestamp_col": "2009-01-19 02:06:08.250000",
    "year": 2009,
    "month": 1
  },
  {
    "id": 187,
    "bool_col": false,
    "tinyint_col": 7,
    "smallint_col": 7,
    "int_col": 7,
    "bigint_col": 70,
    "float_col": 7.699999809265137,
    "double_col": 70.7,
    "date_string_col": "01/19/09",
    "string_col": "7",
    "timestamp_col": "2009-01-19 02:07:08.310000",
    "year": 2009,
    "month": 1
  },
  {
    "id": 188,
    "bool_col": true,
    "tinyint_col": 8,
    "smallint_col": 8,
    "int_col": 8,
    "bigint_col": 80,
    "float_col": 8.800000190734863,
    "double_col": 80.8,
    "date_string_col": "01/19/09",
    "string_col": "8",
    "timestamp_col": "2009-01-19 02:08:08.380000",
    "year": 2009,
    "month": 1
  },
  {
    "id": 189,
    "bool_col": false,
    "tinyint_col": 9,
    "smallint_col": 9,
    "int_col": 9,
    "bigint_col": 90,
    "float_col": 9.899999618530273,
    "double_col": 90.89999999999999,
    "date_string_col": "01/19/09",
    "string_col": "9",
    "timestamp_col": "2009-01-19 02:09:08.460000",
    "year": 2009,
    "month": 1
  },
  {
    "id": 190,
    "bool_col": true,
    "tinyint_col": 0,
    "smallint_col": 0,
    "int_col": 0,
    "bigint_col": 0,
    "float_col": 0.0,
    "double_col": 0.0,
    "date_string_col": "01/20/09",
    "string_col": "0",
    "timestamp_col": "2009-01-20 02:10:08.550000",
    "year": 2009,
    "month": 1
  },
  {
    "id": 191,
    "bool_col": false,
    "tinyint_col": 1,
    "smallint_col": 1,
    "int_col": 1,
    "bigint_col": 10,
    "float_col": 1.100000023841858,
    "double_col": 10.1,
    "date_string_col": "01/20/09",
    "string_col": "1",
    "timestamp_col": "2009-01-20 02:11:08.550000",
    "year": 2009,
    "month": 1
  },
  {
    "id": 192,
    "bool_col": true,
    "tinyint_col": 2,
    "smallint_col": 2,
    "int_col": 2,
    "bigint_col": 20,
    "float_col": 2.200000047683716,
    "double_col": 20.2,
    "date_string_col": "01/20/09",
    "string_col": "2",
    "timestamp_col": "2009-01-20 02:12:08.560000",
    "year": 2009,
    "month": 1
  },
  {
    "id": 193,
    "bool_col": false,
    "tinyint_col": 3,
    "smallint_col": 3,
    "int_col": 3,
    "bigint_col": 30,
    "float_col": 3.299999952316284,
    "double_col": 30.299999999999997,
    "date_string_col": "01/20/09",
    "string_col": "3",
    "timestamp_col": "2009-01-20 02:13:08.580000",
    "year": 2009,
    "month": 1
  },
  {
    "id": 194,
    "bool_col": true,
    "tinyint_col": 4,
    "smallint_col": 4,
    "int_col": 4,
    "bigint_col": 40,
    "float_col": 4.400000095367432,
    "double_col": 40.4,
    "date_string_col": "01/20/09",
    "string_col": "4",
    "timestamp_col": "2009-01-20 02:14:08.610000",
    "year": 2009,
    "month": 1
  },
  {
    "id": 146,
    "bool_col": true,
    "tinyint_col": 6,
    "smallint_col": 6,
    "int_col": 6,
    "bigint_col": 60,
    "float_col": 6.599999904632568,
    "double_col": 60.599999999999994,
    "date_string_col": "01/15/09",
    "string_col": "6",
    "timestamp_col": "2009-01-15 01:26:06.450000",
    "year": 2009,
    "month": 1
  },
  {
    "id": 147,
    "bool_col": false,
    "tinyint_col": 7,
    "smallint_col": 7,
    "int_col": 7,
    "bigint_col": 70,
    "float_col": 7.699999809265137,
    "double_col": 70.7,
    "date_string_col": "01/15/09",
    "string_col": "7",
    "timestamp_col": "2009-01-15 01:27:06.510000",
    "year": 2009,
    "month": 1
  },
  {
    "id": 148,
    "bool_col": true,
    "tinyint_col": 8,
    "smallint_col": 8,
    "int_col": 8,
    "bigint_col": 80,
    "float_col": 8.800000190734863,
    "double_col": 80.8,
    "date_string_col": "01/15/09",
    "string_col": "8",
    "timestamp_col": "2009-01-15 01:28:06.580000",
    "year": 2009,
    "month": 1
  },
  {
    "id": 149,
    "bool_col": false,
    "tinyint_col": 9,
    "smallint_col": 9,
    "int_col": 9,
    "bigint_col": 90,
    "float_col": 9.899999618530273,
    "double_col": 90.89999999999999,
    "date_string_col": "01/15/09",
    "string_col": "9",
    "timestamp_col": "2009-01-15 01:29:06.660000",
    "year": 2009,
    "month": 1
  },
  {
    "id": 150,
    "bool_col": true,
    "tinyint_col": 0,
    "smallint_col": 0,
    "int_col": 0,
    "bigint_col": 0,
    "float_col": 0.0,
    "double_col": 0.0,
    "date_string_col": "01/16/09",
    "string_col": "0",
    "timestamp_col": "2009-01-16 01:30:06.750000",
    "year": 2009,
    "month": 1
  },
  {
    "id": 151,
    "bool_col": false,
    "tinyint_col": 1,
    "smallint_col": 1,
    "int_col": 1,
    "bigint_col": 10,
    "float_col": 1.100000023841858,
    "double_col": 10.1,
    "date_string_col": "01/16/09",
    "string_col": "1",
    "timestamp_col": "2009-01-16 01:31:06.750000",
    "year": 2009,
    "month": 1
  },
  {
    "id": 152,
    "bool_col": true,
    "tinyint_col": 2,
    "smallint_col": 2,
    "int_col": 2,
    "bigint_col": 20,
    "float_col": 2.200000047683716,
    "double_col": 20.2,
    "date_string_col": "01/16/09",
    "string_col": "2",
    "timestamp_col": "2009-01-16 01:32:06.760000",
    "year": 2009,
    "month": 1
  },
  {
    "id": 153,
    "bool_col": false,
    "tinyint_col": 3,
    "smallint_col": 3,
    "int_col": 3,
    "bigint_col": 30,
    "float_col": 3.299999952316284,
    "double_col": 30.299999999999997,
    "date_string_col": "01/16/09",
    "string_col": "3",
    "timestamp_col": "2009-01-16 01:33:06.780000",
    "year": 2009,
    "month": 1
  },
  {
    "id": 154,
    "bool_col": true,
    "tinyint_col": 4,
    "smallint_col": 4,
    "int_col": 4,
    "bigint_col": 40,
    "float_col": 4.400000095367432,
    "double_col": 40.4,
    "date_string_col": "01/16/09",
    "string_col": "4",
    "timestamp_col": "2009-01-16 01:34:06.810000",
    "year": 2009,
    "month": 1
  },
  {
    "id": 155,
    "bool_col": false,
    "tinyint_col": 5,
    "smallint_col": 5,
    "int_col": 5,
    "bigint_col": 50,
    "float_col": 5.5,
    "double_col": 50.5,
    "date_string_col": "01/16/09",
    "string_col": "5",
    "timestamp_col": "2009-01-16 01:35:06.850000",
    "year": 2009,
    "month": 1
  },
  {
    "id": 156,
    "bool_col": true,
    "tinyint_col": 6,
    "smallint_col": 6,
    "int_col": 6,
    "bigint_col": 60,
    "float_col": 6.599999904632568,
    "double_col": 60.599999999999994,
    "date_string_col": "01/16/09",
    "string_col": "6",
    "timestamp_col": "2009-01-16 01:36:06.900000",
    "year": 2009,
    "month": 1
  },
  {
    "id": 157,
    "bool_col": false,
    "tinyint_col": 7,
    "smallint_col": 7,
    "int_col": 7,
    "bigint_col": 70,
    "float_col": 7.699999809265137,
    "double_col": 70.7,
    "date_string_col": "01/16/09",
    "string_col": "7",
    "timestamp_col": "2009-01-16 01:37:06.960000",
    "year": 2009,
    "month": 1
  },
  {
    "id": 158,
    "bool_col": true,
    "tinyint_col": 8,
    "smallint_col": 8,
    "int_col": 8,
    "bigint_col": 80,
    "float_col": 8.800000190734863,
    "double_col": 80.8,
    "date_string_col": "01/16/09",
    "string_col": "8",
    "timestamp_col": "2009-01-16 01:38:07.300000",
    "year": 2009,
    "month": 1
  },
  {
    "id": 159,
    "bool_col": false,
    "tinyint_col": 9,
    "smallint_col": 9,
    "int_col": 9,
    "bigint_col": 90,
    "float_col": 9.899999618530273,
    "double_col": 90.89999999999999,
    "date_string_col": "01/16/09",
    "string_col": "9",
    "timestamp_col": "2009-01-16 01:39:07.110000",
    "year": 2009,
    "month": 1
  },
  {
    "id": 160,
    "bool_col": true,
    "tinyint_col": 0,
    "smallint_col": 0,
    "int_col": 0,
    "bigint_col": 0,
    "float_col": 0.0,
    "double_col": 0.0,
    "date_string_col": "01/17/09",
    "string_col": "0",
    "timestamp_col": "2009-01-17 01:40:07.200000",
    "year": 2009,
    "month": 1
  },
  {
    "id": 161,
    "bool_col": false,
    "tinyint_col": 1,
    "smallint_col": 1,
    "int_col": 1,
    "bigint_col": 10,
    "float_col": 1.100000023841858,
    "double_col": 10.1,
    "date_string_col": "01/17/09",
    "string_col": "1",
    "timestamp_col": "2009-01-17 01:41:07.200000",
    "year": 2009,
    "month": 1
  },
  {
    "id": 162,
    "bool_col": true,
    "tinyint_col": 2,
    "smallint_col": 2,
    "int_col": 2,
    "bigint_col": 20,
    "float_col": 2.200000047683716,
    "double_col": 20.2,
    "date_string_col": "01/17/09",
    "string_col": "2",
    "timestamp_col": "2009-01-17 01:42:07.210000",
    "year": 2009,
    "month": 1
  },
  {
    "id": 163,
    "bool_col": false,
    "tinyint_col": 3,
    "smallint_col": 3,
    "int_col": 3,
    "bigint_col": 30,
    "float_col": 3.299999952316284,
    "double_col": 30.299999999999997,
    "date_string_col": "01/17/09",
    "string_col": "3",
    "timestamp_col": "2009-01-17 01:43:07.230000",
    "year": 2009,
    "month": 1
  },
  {
    "id": 164,
    "bool_col": true,
    "tinyint_col": 4,
    "smallint_col": 4,
    "int_col": 4,
    "bigint_col": 40,
    "float_col": 4.400000095367432,
    "double_col": 40.4,
    "date_string_col": "01/17/09",
    "string_col": "4",
    "timestamp_col": "2009-01-17 01:44:07.260000",
    "year": 2009,
    "month": 1
  },
  {
    "id": 165,
    "bool_col": false,
    "tinyint_col": 5,
    "smallint_col": 5,
    "int_col": 5,
    "bigint_col": 50,
    "float_col": 5.5,
    "double_col": 50.5,
    "date_string_col": "01/17/09",
    "string_col": "5",
    "timestamp_col": "2009-01-17 01:45:07.300000",
    "year": 2009,
    "month": 1
  },
  {
    "id": 166,
    "bool_col": true,
    "tinyint_col": 6,
    "smallint_col": 6,
    "int_col": 6,
    "bigint_col": 60,
    "float_col": 6.599999904632568,
    "double_col": 60.599999999999994,
    "date_string_col": "01/17/09",
    "string_col": "6",
    "timestamp_col": "2009-01-17 01:46:07.350000",
    "year": 2009,
    "month": 1
  },
  {
    "id": 167,
    "bool_col": false,
    "tinyint_col": 7,
    "smallint_col": 7,
    "int_col": 7,
    "bigint_col": 70,
    "float_col": 7.699999809265137,
    "double_col": 70.7,
    "date_string_col": "01/17/09",
    "string_col": "7",
    "timestamp_col": "2009-01-17 01:47:07.410000",
    "year": 2009,
    "month": 1
  },
  {
    "id": 168,
    "bool_col": true,
    "tinyint_col": 8,
    "smallint_col": 8,
    "int_col": 8,
    "bigint_col": 80,
    "float_col": 8.800000190734863,
    "double_col": 80.8,
    "date_string_col": "01/17/09",
    "string_col": "8",
    "timestamp_col": "2009-01-17 01:48:07.480000",
    "year": 2009,
    "month": 1
  },
  {
    "id": 169,
    "bool_col": false,
    "tinyint_col": 9,
    "smallint_col": 9,
    "int_col": 9,
    "bigint_col": 90,
    "float_col": 9.899999618530273,
    "double_col": 90.89999999999999,
    "date_string_col": "01/17/09",
    "string_col": "9",
    "timestamp_col": "2009-01-17 01:49:07.560000",
    "year": 2009,
    "month": 1
  },
  {
    "id": 170,
    "bool_col": true,
    "tinyint_col": 0,
    "smallint_col": 0,
    "int_col": 0,
    "bigint_col": 0,
    "float_col": 0.0,
    "double_col": 0.0,
    "date_string_col": "01/18/09",
    "string_col": "0",
    "timestamp_col": "2009-01-18 01:50:07.650000",
    "year": 2009,
    "month": 1
  },
  {
    "id": 62,
    "bool_col": true,
    "tinyint_col": 2,
    "smallint_col": 2,
    "int_col": 2,
    "bigint_col": 20,
    "float_col": 2.200000047683716,
    "double_col": 20.2,
    "date_string_col": "01/07/09",
    "string_col": "2",
    "timestamp_col": "2009-01-07 00:02:02.710000",
    "year": 2009,
    "month": 1
  },
  {
    "id": 61,
    "bool_col": false,
    "tinyint_col": 1,
    "smallint_col": 1,
    "int_col": 1,
    "bigint_col": 10,
    "float_col": 1.100000023841858,
    "double_col": 10.1,
    "date_string_col": "01/07/09",
    "string_col": "1",
    "timestamp_col": "2009-01-07 00:01:02.700000",
    "year": 2009,
    "month": 1
  },
  {
    "id": 60,
    "bool_col": true,
    "tinyint_col": 0,
    "smallint_col": 0,
    "int_col": 0,
    "bigint_col": 0,
    "float_col": 0.0,
    "double_col": 0.0,
    "date_string_col": "01/07/09",
    "string_col": "0",
    "timestamp_col": "2009-01-07 00:00:02.700000",
    "year": 2009,
    "month": 1
  },
  {
    "id": 59,
    "bool_col": false,
    "tinyint_col": 9,
    "smallint_col": 9,
    "int_col": 9,
    "bigint_col": 90,
    "float_col": 9.899999618530273,
    "double_col": 90.89999999999999,
    "date_string_col": "01/06/09",
    "string_col": "9",
    "timestamp_col": "2009-01-05 23:59:02.610000",
    "year": 2009,
    "month": 1
  },
  {
    "id": 58,
    "bool_col": true,
    "tinyint_col": 8,
    "smallint_col": 8,
    "int_col": 8,
    "bigint_col": 80,
    "float_col": 8.800000190734863,
    "double_col": 80.8,
    "date_string_col": "01/06/09",
    "string_col": "8",
    "timestamp_col": "2009-01-05 23:58:02.530000",
    "year": 2009,
    "month": 1
  },
  {
    "id": 57,
    "bool_col": false,
    "tinyint_col": 7,
    "smallint_col": 7,
    "int_col": 7,
    "bigint_col": 70,
    "float_col": 7.699999809265137,
    "double_col": 70.7,
    "date_string_col": "01/06/09",
    "string_col": "7",
    "timestamp_col": "2009-01-05 23:57:02.460000",
    "year": 2009,
    "month": 1
  },
  {
    "id": 56,
    "bool_col": true,
    "tinyint_col": 6,
    "smallint_col": 6,
    "int_col": 6,
    "bigint_col": 60,
    "float_col": 6.599999904632568,
    "double_col": 60.599999999999994,
    "date_string_col": "01/06/09",
    "string_col": "6",
    "timestamp_col": "2009-01-05 23:56:02.400000",
    "year": 2009,
    "month": 1
  },
  {
    "id": 55,
    "bool_col": false,
    "tinyint_col": 5,
    "smallint_col": 5,
    "int_col": 5,
    "bigint_col": 50,
    "float_col": 5.5,
    "double_col": 50.5,
    "date_string_col": "01/06/09",
    "string_col": "5",
    "timestamp_col": "2009-01-05 23:55:02.350000",
    "year": 2009,
    "month": 1
  },
  {
    "id": 54,
    "bool_col": true,
    "tinyint_col": 4,
    "smallint_col": 4,
    "int_col": 4,
    "bigint_col": 40,
    "float_col": 4.400000095367432,
    "double_col": 40.4,
    "date_string_col": "01/06/09",
    "string_col": "4",
    "timestamp_col": "2009-01-05 23:54:02.310000",
    "year": 2009,
    "month": 1
  },
  {
    "id": 53,
    "bool_col": false,
    "tinyint_col": 3,
    "smallint_col": 3,
    "int_col": 3,
    "bigint_col": 30,
    "float_col": 3.299999952316284,
    "double_col": 30.299999999999997,
    "date_string_col": "01/06/09",
    "string_col": "3",
    "timestamp_col": "2009-01-05 23:53:02.280000",
    "year": 2009,
    "month": 1
  },
  {
    "id": 52,
    "bool_col": true,
    "tinyint_col": 2,
    "smallint_col": 2,
    "int_col": 2,
    "bigint_col": 20,
    "float_col": 2.200000047683716,
    "double_col": 20.2,
    "date_string_col": "01/06/09",
    "string_col": "2",
    "timestamp_col": "2009-01-05 23:52:02.260000",
    "year": 2009,
    "month": 1
  },
  {
    "id": 51,
    "bool_col": false,
    "tinyint_col": 1,
    "smallint_col": 1,
    "int_col": 1,
    "bigint_col": 10,
    "float_col": 1.100000023841858,
    "double_col": 10.1,
    "date_string_col": "01/06/09",
    "string_col": "1",
    "timestamp_col": "2009-01-05 23:51:02.250000",
    "year": 2009,
    "month": 1
  },
  {
    "id": 50,
    "bool_col": true,
    "tinyint_col": 0,
    "smallint_col": 0,
    "int_col": 0,
    "bigint_col": 0,
    "float_col": 0.0,
    "double_col": 0.0,
    "date_string_col": "01/06/09",
    "string_col": "0",
    "timestamp_col": "2009-01-05 23:50:02.250000",
    "year": 2009,
    "month": 1
  },
  {
    "id": 49,
    "bool_col": false,
    "tinyint_col": 9,
    "smallint_col": 9,
    "int_col": 9,
    "bigint_col": 90,
    "float_col": 9.899999618530273,
    "double_col": 90.89999999999999,
    "date_string_col": "01/05/09",
    "string_col": "9",
    "timestamp_col": "2009-01-04 23:49:02.160000",
    "year": 2009,
    "month": 1
  },
  {
    "id": 48,
    "bool_col": true,
    "tinyint_col": 8,
    "smallint_col": 8,
    "int_col": 8,
    "bigint_col": 80,
    "float_col": 8.800000190734863,
    "double_col": 80.8,
    "date_string_col": "01/05/09",
    "string_col": "8",
    "timestamp_col": "2009-01-04 23:48:02.800000",
    "year": 2009,
    "month": 1
  },
  {
    "id": 47,
    "bool_col": false,
    "tinyint_col": 7,
    "smallint_col": 7,
    "int_col": 7,
    "bigint_col": 70,
    "float_col": 7.699999809265137,
    "double_col": 70.7,
    "date_string_col": "01/05/09",
    "string_col": "7",
    "timestamp_col": "2009-01-04 23:47:02.100000",
    "year": 2009,
    "month": 1
  },
  {
    "id": 46,
    "bool_col": true,
    "tinyint_col": 6,
    "smallint_col": 6,
    "int_col": 6,
    "bigint_col": 60,
    "float_col": 6.599999904632568,
    "double_col": 60.599999999999994,
    "date_string_col": "01/05/09",
    "string_col": "6",
    "timestamp_col": "2009-01-04 23:46:01.950000",
    "year": 2009,
    "month": 1
  },
  {
    "id": 45,
    "bool_col": false,
    "tinyint_col": 5,
    "smallint_col": 5,
    "int_col": 5,
    "bigint_col": 50,
    "float_col": 5.5,
    "double_col": 50.5,
    "date_string_col": "01/05/09",
    "string_col": "5",
    "timestamp_col": "2009-01-04 23:45:01.900000",
    "year": 2009,
    "month": 1
  },
  {
    "id": 44,
    "bool_col": true,
    "tinyint_col": 4,
    "smallint_col": 4,
    "int_col": 4,
    "bigint_col": 40,
    "float_col": 4.400000095367432,
    "double_col": 40.4,
    "date_string_col": "01/05/09",
    "string_col": "4",
    "timestamp_col": "2009-01-04 23:44:01.860000",
    "year": 2009,
    "month": 1
  },
  {
    "id": 43,
    "bool_col": false,
    "tinyint_col": 3,
    "smallint_col": 3,
    "int_col": 3,
    "bigint_col": 30,
    "float_col": 3.299999952316284,
    "double_col": 30.299999999999997,
    "date_string_col": "01/05/09",
    "string_col": "3",
    "timestamp_col": "2009-01-04 23:43:01.830000",
    "year": 2009,
    "month": 1
  },
  {
    "id": 42,
    "bool_col": true,
    "tinyint_col": 2,
    "smallint_col": 2,
    "int_col": 2,
    "bigint_col": 20,
    "float_col": 2.200000047683716,
    "double_col": 20.2,
    "date_string_col": "01/05/09",
    "string_col": "2",
    "timestamp_col": "2009-01-04 23:42:01.810000",
    "year": 2009,
    "month": 1
  },
  {
    "id": 41,
    "bool_col": false,
    "tinyint_col": 1,
    "smallint_col": 1,
    "int_col": 1,
    "bigint_col": 10,
    "float_col": 1.100000023841858,
    "double_col": 10.1,
    "date_string_col": "01/05/09",
    "string_col": "1",
    "timestamp_col": "2009-01-04 23:41:01.800000",
    "year": 2009,
    "month": 1
  },
  {
    "id": 40,
    "bool_col": true,
    "tinyint_col": 0,
    "smallint_col": 0,
    "int_col": 0,
    "bigint_col": 0,
    "float_col": 0.0,
    "double_col": 0.0,
    "date_string_col": "01/05/09",
    "string_col": "0",
    "timestamp_col": "2009-01-04 23:40:01.800000",
    "year": 2009,
    "month": 1
  },
  {
    "id": 39,
    "bool_col": false,
    "tinyint_col": 9,
    "smallint_col": 9,
    "int_col": 9,
    "bigint_col": 90,
    "float_col": 9.899999618530273,
    "double_col": 90.89999999999999,
    "date_string_col": "01/04/09",
    "string_col": "9",
    "timestamp_col": "2009-01-03 23:39:01.710000",
    "year": 2009,
    "month": 1
  },
  {
    "id": 87,
    "bool_col": false,
    "tinyint_col": 7,
    "smallint_col": 7,
    "int_col": 7,
    "bigint_col": 70,
    "float_col": 7.699999809265137,
    "double_col": 70.7,
    "date_string_col": "01/09/09",
    "string_col": "7",
    "timestamp_col": "2009-01-09 00:27:03.810000",
    "year": 2009,
    "month": 1
  },
  {
    "id": 86,
    "bool_col": true,
    "tinyint_col": 6,
    "smallint_col": 6,
    "int_col": 6,
    "bigint_col": 60,
    "float_col": 6.599999904632568,
    "double_col": 60.599999999999994,
    "date_string_col": "01/09/09",
    "string_col": "6",
    "timestamp_col": "2009-01-09 00:26:03.750000",
    "year": 2009,
    "month": 1
  },
  {
    "id": 85,
    "bool_col": false,
    "tinyint_col": 5,
    "smallint_col": 5,
    "int_col": 5,
    "bigint_col": 50,
    "float_col": 5.5,
    "double_col": 50.5,
    "date_string_col": "01/09/09",
    "string_col": "5",
    "timestamp_col": "2009-01-09 00:25:03.700000",
    "year": 2009,
    "month": 1
  },
  {
    "id": 84,
    "bool_col": true,
    "tinyint_col": 4,
    "smallint_col": 4,
    "int_col": 4,
    "bigint_col": 40,
    "float_col": 4.400000095367432,
    "double_col": 40.4,
    "date_string_col": "01/09/09",
    "string_col": "4",
    "timestamp_col": "2009-01-09 00:24:03.660000",
    "year": 2009,
    "month": 1
  },
  {
    "id": 83,
    "bool_col": false,
    "tinyint_col": 3,
    "smallint_col": 3,
    "int_col": 3,
    "bigint_col": 30,
    "float_col": 3.299999952316284,
    "double_col": 30.299999999999997,
    "date_string_col": "01/09/09",
    "string_col": "3",
    "timestamp_col": "2009-01-09 00:23:03.630000",
    "year": 2009,
    "month": 1
  },
  {
    "id": 82,
    "bool_col": true,
    "tinyint_col": 2,
    "smallint_col": 2,
    "int_col": 2,
    "bigint_col": 20,
    "float_col": 2.200000047683716,
    "double_col": 20.2,
    "date_string_col": "01/09/09",
    "string_col": "2",
    "timestamp_col": "2009-01-09 00:22:03.610000",
    "year": 2009,
    "month": 1
  },
  {
    "id": 81,
    "bool_col": false,
    "tinyint_col": 1,
    "smallint_col": 1,
    "int_col": 1,
    "bigint_col": 10,
    "float_col": 1.100000023841858,
    "double_col": 10.1,
    "date_string_col": "01/09/09",
    "string_col": "1",
    "timestamp_col": "2009-01-09 00:21:03.600000",
    "year": 2009,
    "month": 1
  },
  {
    "id": 80,
    "bool_col": true,
    "tinyint_col": 0,
    "smallint_col": 0,
    "int_col": 0,
    "bigint_col": 0,
    "float_col": 0.0,
    "double_col": 0.0,
    "date_string_col": "01/09/09",
    "string_col": "0",
    "timestamp_col": "2009-01-09 00:20:03.600000",
    "year": 2009,
    "month": 1
  },
  {
    "id": 79,
    "bool_col": false,
    "tinyint_col": 9,
    "smallint_col": 9,
    "int_col": 9,
    "bigint_col": 90,
    "float_col": 9.899999618530273,
    "double_col": 90.89999999999999,
    "date_string_col": "01/08/09",
    "string_col": "9",
    "timestamp_col": "2009-01-08 00:19:03.510000",
    "year": 2009,
    "month": 1
  },
  {
    "id": 78,
    "bool_col": true,
    "tinyint_col": 8,
    "smallint_col": 8,
    "int_col": 8,
    "bigint_col": 80,
    "float_col": 8.800000190734863,
    "double_col": 80.8,
    "date_string_col": "01/08/09",
    "string_col": "8",
    "timestamp_col": "2009-01-08 00:18:03.430000",
    "year": 2009,
    "month": 1
  },
  {
    "id": 77,
    "bool_col": false,
    "tinyint_col": 7,
    "smallint_col": 7,
    "int_col": 7,
    "bigint_col": 70,
    "float_col": 7.699999809265137,
    "double_col": 70.7,
    "date_string_col": "01/08/09",
    "string_col": "7",
    "timestamp_col": "2009-01-08 00:17:03.360000",
    "year": 2009,
    "month": 1
  },
  {
    "id": 76,
    "bool_col": true,
    "tinyint_col": 6,
    "smallint_col": 6,
    "int_col": 6,
    "bigint_col": 60,
    "float_col": 6.599999904632568,
    "double_col": 60.599999999999994,
    "date_string_col": "01/08/09",
    "string_col": "6",
    "timestamp_col": "2009-01-08 00:16:03.300000",
    "year": 2009,
    "month": 1
  },
  {
    "id": 75,
    "bool_col": false,
    "tinyint_col": 5,
    "smallint_col": 5,
    "int_col": 5,
    "bigint_col": 50,
    "float_col": 5.5,
    "double_col": 50.5,
    "date_string_col": "01/08/09",
    "string_col": "5",
    "timestamp_col": "2009-01-08 00:15:03.250000",
    "year": 2009,
    "month": 1
  },
  {
    "id": 74,
    "bool_col": true,
    "tinyint_col": 4,
    "smallint_col": 4,
    "int_col": 4,
    "bigint_col": 40,
    "float_col": 4.400000095367432,
    "double_col": 40.4,
    "date_string_col": "01/08/09",
    "string_col": "4",
    "timestamp_col": "2009-01-08 00:14:03.210000",
    "year": 2009,
    "month": 1
  },
  {
    "id": 73,
    "bool_col": false,
    "tinyint_col": 3,
    "smallint_col": 3,
    "int_col": 3,
    "bigint_col": 30,
    "float_col": 3.299999952316284,
    "double_col": 30.299999999999997,
    "date_string_col": "01/08/09",
    "string_col": "3",
    "timestamp_col": "2009-01-08 00:13:03.180000",
    "year": 2009,
    "month": 1
  },
  {
    "id": 72,
    "bool_col": true,
    "tinyint_col": 2,
    "smallint_col": 2,
    "int_col": 2,
    "bigint_col": 20,
    "float_col": 2.200000047683716,
    "double_col": 20.2,
    "date_string_col": "01/08/09",
    "string_col": "2",
    "timestamp_col": "2009-01-08 00:12:03.160000",
    "year": 2009,
    "month": 1
  },
  {
    "id": 71,
    "bool_col": false,
    "tinyint_col": 1,
    "smallint_col": 1,
    "int_col": 1,
    "bigint_col": 10,
    "float_col": 1.100000023841858,
    "double_col": 10.1,
    "date_string_col": "01/08/09",
    "string_col": "1",
    "timestamp_col": "2009-01-08 00:11:03.150000",
    "year": 2009,
    "month": 1
  },
  {
    "id": 70,
    "bool_col": true,
    "tinyint_col": 0,
    "smallint_col": 0,
    "int_col": 0,
    "bigint_col": 0,
    "float_col": 0.0,
    "double_col": 0.0,
    "date_string_col": "01/08/09",
    "string_col": "0",
    "timestamp_col": "2009-01-08 00:10:03.150000",
    "year": 2009,
    "month": 1
  },
  {
    "id": 69,
    "bool_col": false,
    "tinyint_col": 9,
    "smallint_col": 9,
    "int_col": 9,
    "bigint_col": 90,
    "float_col": 9.899999618530273,
    "double_col": 90.89999999999999,
    "date_string_col": "01/07/09",
    "string_col": "9",
    "timestamp_col": "2009-01-07 00:09:03.600000",
    "year": 2009,
    "month": 1
  },
  {
    "id": 68,
    "bool_col": true,
    "tinyint_col": 8,
    "smallint_col": 8,
    "int_col": 8,
    "bigint_col": 80,
    "float_col": 8.800000190734863,
    "double_col": 80.8,
    "date_string_col": "01/07/09",
    "string_col": "8",
    "timestamp_col": "2009-01-07 00:08:02.980000",
    "year": 2009,
    "month": 1
  },
  {
    "id": 67,
    "bool_col": false,
    "tinyint_col": 7,
    "smallint_col": 7,
    "int_col": 7,
    "bigint_col": 70,
    "float_col": 7.699999809265137,
    "double_col": 70.7,
    "date_string_col": "01/07/09",
    "string_col": "7",
    "timestamp_col": "2009-01-07 00:07:02.910000",
    "year": 2009,
    "month": 1
  },
  {
    "id": 66,
    "bool_col": true,
    "tinyint_col": 6,
    "smallint_col": 6,
    "int_col": 6,
    "bigint_col": 60,
    "float_col": 6.599999904632568,
    "double_col": 60.599999999999994,
    "date_string_col": "01/07/09",
    "string_col": "6",
    "timestamp_col": "2009-01-07 00:06:02.850000",
    "year": 2009,
    "month": 1
  },
  {
    "id": 65,
    "bool_col": false,
    "tinyint_col": 5,
    "smallint_col": 5,
    "int_col": 5,
    "bigint_col": 50,
    "float_col": 5.5,
    "double_col": 50.5,
    "date_string_col": "01/07/09",
    "string_col": "5",
    "timestamp_col": "2009-01-07 00:05:02.800000",
    "year": 2009,
    "month": 1
  },
  {
    "id": 64,
    "bool_col": true,
    "tinyint_col": 4,
    "smallint_col": 4,
    "int_col": 4,
    "bigint_col": 40,
    "float_col": 4.400000095367432,
    "double_col": 40.4,
    "date_string_col": "01/07/09",
    "string_col": "4",
    "timestamp_col": "2009-01-07 00:04:02.760000",
    "year": 2009,
    "month": 1
  },
  {
    "id": 63,
    "bool_col": false,
    "tinyint_col": 3,
    "smallint_col": 3,
    "int_col": 3,
    "bigint_col": 30,
    "float_col": 3.299999952316284,
    "double_col": 30.299999999999997,
    "date_string_col": "01/07/09",
    "string_col": "3",
    "timestamp_col": "2009-01-07 00:03:02.730000",
    "year": 2009,
    "month": 1
  },
  {
    "id": 13,
    "bool_col": false,
    "tinyint_col": 3,
    "smallint_col": 3,
    "int_col": 3,
    "bigint_col": 30,
    "float_col": 3.299999952316284,
    "double_col": 30.299999999999997,
    "date_string_col": "01/02/09",
    "string_col": "3",
    "timestamp_col": "2009-01-01 23:13:00.480000",
    "year": 2009,
    "month": 1
  },
  {
    "id": 12,
    "bool_col": true,
    "tinyint_col": 2,
    "smallint_col": 2,
    "int_col": 2,
    "bigint_col": 20,
    "float_col": 2.200000047683716,
    "double_col": 20.2,
    "date_string_col": "01/02/09",
    "string_col": "2",
    "timestamp_col": "2009-01-01 23:12:00.460000",
    "year": 2009,
    "month": 1
  },
  {
    "id": 11,
    "bool_col": false,
    "tinyint_col": 1,
    "smallint_col": 1,
    "int_col": 1,
    "bigint_col": 10,
    "float_col": 1.100000023841858,
    "double_col": 10.1,
    "date_string_col": "01/02/09",
    "string_col": "1",
    "timestamp_col": "2009-01-01 23:11:00.450000",
    "year": 2009,
    "month": 1
  },
  {
    "id": 10,
    "bool_col": true,
    "tinyint_col": 0,
    "smallint_col": 0,
    "int_col": 0,
    "bigint_col": 0,
    "float_col": 0.0,
    "double_col": 0.0,
    "date_string_col": "01/02/09",
    "string_col": "0",
    "timestamp_col": "2009-01-01 23:10:00.450000",
    "year": 2009,
    "month": 1
  },
  {
    "id": 9,
    "bool_col": false,
    "tinyint_col": 9,
    "smallint_col": 9,
    "int_col": 9,
    "bigint_col": 90,
    "float_col": 9.899999618530273,
    "double_col": 90.89999999999999,
    "date_string_col": "01/01/09",
    "string_col": "9",
    "timestamp_col": "2008-12-31 23:09:00.360000",
    "year": 2009,
    "month": 1
  },
  {
    "id": 8,
    "bool_col": true,
    "tinyint_col": 8,
    "smallint_col": 8,
    "int_col": 8,
    "bigint_col": 80,
    "float_col": 8.800000190734863,
    "double_col": 80.8,
    "date_string_col": "01/01/09",
    "string_col": "8",
    "timestamp_col": "2008-12-31 23:08:00.280000",
    "year": 2009,
    "month": 1
  },
  {
    "id": 7,
    "bool_col": false,
    "tinyint_col": 7,
    "smallint_col": 7,
    "int_col": 7,
    "bigint_col": 70,
    "float_col": 7.699999809265137,
    "double_col": 70.7,
    "date_string_col": "01/01/09",
    "string_col": "7",
    "timestamp_col": "2008-12-31 23:07:00.210000",
    "year": 2009,
    "month": 1
  },
  {
    "id": 6,
    "bool_col": true,
    "tinyint_col": 6,
    "smallint_col": 6,
    "int_col": 6,
    "bigint_col": 60,
    "float_col": 6.599999904632568,
    "double_col": 60.599999999999994,
    "date_string_col": "01/01/09",
    "string_col": "6",
    "timestamp_col": "2008-12-31 23:06:00.150000",
    "year": 2009,
    "month": 1
  },
  {
    "id": 5,
    "bool_col": false,
    "tinyint_col": 5,
    "smallint_col": 5,
    "int_col": 5,
    "bigint_col": 50,
    "float_col": 5.5,
    "double_col": 50.5,
    "date_string_col": "01/01/09",
    "string_col": "5",
    "timestamp_col": "2008-12-31 23:05:00.100000",
    "year": 2009,
    "month": 1
  },
  {
    "id": 4,
    "bool_col": true,
    "tinyint_col": 4,
    "smallint_col": 4,
    "int_col": 4,
    "bigint_col": 40,
    "float_col": 4.400000095367432,
    "double_col": 40.4,
    "date_string_col": "01/01/09",
    "string_col": "4",
    "timestamp_col": "2008-12-31 23:04:00.600000",
    "year": 2009,
    "month": 1
  },
  {
    "id": 3,
    "bool_col": false,
    "tinyint_col": 3,
    "smallint_col": 3,
    "int_col": 3,
    "bigint_col": 30,
    "float_col": 3.299999952316284,
    "double_col": 30.299999999999997,
    "date_string_col": "01/01/09",
    "string_col": "3",
    "timestamp_col": "2008-12-31 23:03:00.300000",
    "year": 2009,
    "month": 1
  },
  {
    "id": 2,
    "bool_col": true,
    "tinyint_col": 2,
    "smallint_col": 2,
    "int_col": 2,
    "bigint_col": 20,
    "float_col": 2.200000047683716,
    "double_col": 20.2,
    "date_string_col": "01/01/09",
    "string_col": "2",
    "timestamp_col": "2008-12-31 23:02:00.100000",
    "year": 2009,
    "month": 1
  },
  {
    "id": 1,
    "bool_col": false,
    "tinyint_col": 1,
    "smallint_col": 1,
    "int_col": 1,
    "bigint_col": 10,
    "float_col": 1.100000023841858,
    "double_col": 10.1,
    "date_string_col": "01/01/09",
    "string_col": "1",
    "timestamp_col": "2008-12-31 23:01:00",
    "year": 2009,
    "month": 1
  },
  {
    "id": 0,
    "bool_col": true,
    "tinyint_col": 0,
    "smallint_col": 0,
    "int_col": 0,
    "bigint_col": 0,
    "float_col": 0.0,
    "double_col": 0.0,
    "date_string_col": "01/01/09",
    "string_col": "0",
    "timestamp_col": "2008-12-31 23:00:00",
    "year": 2009,
    "month": 1
  },
  {
    "id": 88,
    "bool_col": true,
    "tinyint_col": 8,
    "smallint_col": 8,
    "int_col": 8,
    "bigint_col": 80,
    "float_col": 8.800000190734863,
    "double_col": 80.8,
    "date_string_col": "01/09/09",
    "string_col": "8",
    "timestamp_col": "2009-01-09 00:28:03.880000",
    "year": 2009,
    "month": 1
  },
  {
    "id": 89,
    "bool_col": false,
    "tinyint_col": 9,
    "smallint_col": 9,
    "int_col": 9,
    "bigint_col": 90,
    "float_col": 9.899999618530273,
    "double_col": 90.89999999999999,
    "date_string_col": "01/09/09",
    "string_col": "9",
    "timestamp_col": "2009-01-09 00:29:03.960000",
    "year": 2009,
    "month": 1
  },
  {
    "id": 90,
    "bool_col": true,
    "tinyint_col": 0,
    "smallint_col": 0,
    "int_col": 0,
    "bigint_col": 0,
    "float_col": 0.0,
    "double_col": 0.0,
    "date_string_col": "01/10/09",
    "string_col": "0",
    "timestamp_col": "2009-01-10 00:30:04.500000",
    "year": 2009,
    "month": 1
  },
  {
    "id": 91,
    "bool_col": false,
    "tinyint_col": 1,
    "smallint_col": 1,
    "int_col": 1,
    "bigint_col": 10,
    "float_col": 1.100000023841858,
    "double_col": 10.1,
    "date_string_col": "01/10/09",
    "string_col": "1",
    "timestamp_col": "2009-01-10 00:31:04.500000",
    "year": 2009,
    "month": 1
  },
  {
    "id": 92,
    "bool_col": true,
    "tinyint_col": 2,
    "smallint_col": 2,
    "int_col": 2,
    "bigint_col": 20,
    "float_col": 2.200000047683716,
    "double_col": 20.2,
    "date_string_col": "01/10/09",
    "string_col": "2",
    "timestamp_col": "2009-01-10 00:32:04.600000",
    "year": 2009,
    "month": 1
  },
  {
    "id": 93,
    "bool_col": false,
    "tinyint_col": 3,
    "smallint_col": 3,
    "int_col": 3,
    "bigint_col": 30,
    "float_col": 3.299999952316284,
    "double_col": 30.299999999999997,
    "date_string_col": "01/10/09",
    "string_col": "3",
    "timestamp_col": "2009-01-10 00:33:04.800000",
    "year": 2009,
    "month": 1
  },
  {
    "id": 94,
    "bool_col": true,
    "tinyint_col": 4,
    "smallint_col": 4,
    "int_col": 4,
    "bigint_col": 40,
    "float_col": 4.400000095367432,
    "double_col": 40.4,
    "date_string_col": "01/10/09",
    "string_col": "4",
    "timestamp_col": "2009-01-10 00:34:04.110000",
    "year": 2009,
    "month": 1
  },
  {
    "id": 95,
    "bool_col": false,
    "tinyint_col": 5,
    "smallint_col": 5,
    "int_col": 5,
    "bigint_col": 50,
    "float_col": 5.5,
    "double_col": 50.5,
    "date_string_col": "01/10/09",
    "string_col": "5",
    "timestamp_col": "2009-01-10 00:35:04.150000",
    "year": 2009,
    "month": 1
  },
  {
    "id": 96,
    "bool_col": true,
    "tinyint_col": 6,
    "smallint_col": 6,
    "int_col": 6,
    "bigint_col": 60,
    "float_col": 6.599999904632568,
    "double_col": 60.599999999999994,
    "date_string_col": "01/10/09",
    "string_col": "6",
    "timestamp_col": "2009-01-10 00:36:04.200000",
    "year": 2009,
    "month": 1
  },
  {
    "id": 97,
    "bool_col": false,
    "tinyint_col": 7,
    "smallint_col": 7,
    "int_col": 7,
    "bigint_col": 70,
    "float_col": 7.699999809265137,
    "double_col": 70.7,
    "date_string_col": "01/10/09",
    "string_col": "7",
    "timestamp_col": "2009-01-10 00:37:04.260000",
    "year": 2009,
    "month": 1
  },
  {
    "id": 38,
    "bool_col": true,
    "tinyint_col": 8,
    "smallint_col": 8,
    "int_col": 8,
    "bigint_col": 80,
    "float_col": 8.800000190734863,
    "double_col": 80.8,
    "date_string_col": "01/04/09",
    "string_col": "8",
    "timestamp_col": "2009-01-03 23:38:01.630000",
    "year": 2009,
    "month": 1
  },
  {
    "id": 37,
    "bool_col": false,
    "tinyint_col": 7,
    "smallint_col": 7,
    "int_col": 7,
    "bigint_col": 70,
    "float_col": 7.699999809265137,
    "double_col": 70.7,
    "date_string_col": "01/04/09",
    "string_col": "7",
    "timestamp_col": "2009-01-03 23:37:01.560000",
    "year": 2009,
    "month": 1
  },
  {
    "id": 36,
    "bool_col": true,
    "tinyint_col": 6,
    "smallint_col": 6,
    "int_col": 6,
    "bigint_col": 60,
    "float_col": 6.599999904632568,
    "double_col": 60.599999999999994,
    "date_string_col": "01/04/09",
    "string_col": "6",
    "timestamp_col": "2009-01-03 23:36:01.500000",
    "year": 2009,
    "month": 1
  },
  {
    "id": 35,
    "bool_col": false,
    "tinyint_col": 5,
    "smallint_col": 5,
    "int_col": 5,
    "bigint_col": 50,
    "float_col": 5.5,
    "double_col": 50.5,
    "date_string_col": "01/04/09",
    "string_col": "5",
    "timestamp_col": "2009-01-03 23:35:01.450000",
    "year": 2009,
    "month": 1
  },
  {
    "id": 34,
    "bool_col": true,
    "tinyint_col": 4,
    "smallint_col": 4,
    "int_col": 4,
    "bigint_col": 40,
    "float_col": 4.400000095367432,
    "double_col": 40.4,
    "date_string_col": "01/04/09",
    "string_col": "4",
    "timestamp_col": "2009-01-03 23:34:01.410000",
    "year": 2009,
    "month": 1
  },
  {
    "id": 33,
    "bool_col": false,
    "tinyint_col": 3,
    "smallint_col": 3,
    "int_col": 3,
    "bigint_col": 30,
    "float_col": 3.299999952316284,
    "double_col": 30.299999999999997,
    "date_string_col": "01/04/09",
    "string_col": "3",
    "timestamp_col": "2009-01-03 23:33:01.380000",
    "year": 2009,
    "month": 1
  },
  {
    "id": 32,
    "bool_col": true,
    "tinyint_col": 2,
    "smallint_col": 2,
    "int_col": 2,
    "bigint_col": 20,
    "float_col": 2.200000047683716,
    "double_col": 20.2,
    "date_string_col": "01/04/09",
    "string_col": "2",
    "timestamp_col": "2009-01-03 23:32:01.360000",
    "year": 2009,
    "month": 1
  },
  {
    "id": 31,
    "bool_col": false,
    "tinyint_col": 1,
    "smallint_col": 1,
    "int_col": 1,
    "bigint_col": 10,
    "float_col": 1.100000023841858,
    "double_col": 10.1,
    "date_string_col": "01/04/09",
    "string_col": "1",
    "timestamp_col": "2009-01-03 23:31:01.350000",
    "year": 2009,
    "month": 1
  },
  {
    "id": 30,
    "bool_col": true,
    "tinyint_col": 0,
    "smallint_col": 0,
    "int_col": 0,
    "bigint_col": 0,
    "float_col": 0.0,
    "double_col": 0.0,
    "date_string_col": "01/04/09",
    "string_col": "0",
    "timestamp_col": "2009-01-03 23:30:01.350000",
    "year": 2009,
    "month": 1
  },
  {
    "id": 29,
    "bool_col": false,
    "tinyint_col": 9,
    "smallint_col": 9,
    "int_col": 9,
    "bigint_col": 90,
    "float_col": 9.899999618530273,
    "double_col": 90.89999999999999,
    "date_string_col": "01/03/09",
    "string_col": "9",
    "timestamp_col": "2009-01-02 23:29:01.260000",
    "year": 2009,
    "month": 1
  },
  {
    "id": 28,
    "bool_col": true,
    "tinyint_col": 8,
    "smallint_col": 8,
    "int_col": 8,
    "bigint_col": 80,
    "float_col": 8.800000190734863,
    "double_col": 80.8,
    "date_string_col": "01/03/09",
    "string_col": "8",
    "timestamp_col": "2009-01-02 23:28:01.180000",
    "year": 2009,
    "month": 1
  },
  {
    "id": 27,
    "bool_col": false,
    "tinyint_col": 7,
    "smallint_col": 7,
    "int_col": 7,
    "bigint_col": 70,
    "float_col": 7.699999809265137,
    "double_col": 70.7,
    "date_string_col": "01/03/09",
    "string_col": "7",
    "timestamp_col": "2009-01-02 23:27:01.110000",
    "year": 2009,
    "month": 1
  },
  {
    "id": 26,
    "bool_col": true,
    "tinyint_col": 6,
    "smallint_col": 6,
    "int_col": 6,
    "bigint_col": 60,
    "float_col": 6.599999904632568,
    "double_col": 60.599999999999994,
    "date_string_col": "01/03/09",
    "string_col": "6",
    "timestamp_col": "2009-01-02 23:26:01.500000",
    "year": 2009,
    "month": 1
  },
  {
    "id": 25,
    "bool_col": false,
    "tinyint_col": 5,
    "smallint_col": 5,
    "int_col": 5,
    "bigint_col": 50,
    "float_col": 5.5,
    "double_col": 50.5,
    "date_string_col": "01/03/09",
    "string_col": "5",
    "timestamp_col": "2009-01-02 23:25:01",
    "year": 2009,
    "month": 1
  },
  {
    "id": 24,
    "bool_col": true,
    "tinyint_col": 4,
    "smallint_col": 4,
    "int_col": 4,
    "bigint_col": 40,
    "float_col": 4.400000095367432,
    "double_col": 40.4,
    "date_string_col": "01/03/09",
    "string_col": "4",
    "timestamp_col": "2009-01-02 23:24:00.960000",
    "year": 2009,
    "month": 1
  },
  {
    "id": 23,
    "bool_col": false,
    "tinyint_col": 3,
    "smallint_col": 3,
    "int_col": 3,
    "bigint_col": 30,
    "float_col": 3.299999952316284,
    "double_col": 30.299999999999997,
    "date_string_col": "01/03/09",
    "string_col": "3",
    "timestamp_col": "2009-01-02 23:23:00.930000",
    "year": 2009,
    "month": 1
  },
  {
    "id": 22,
    "bool_col": true,
    "tinyint_col": 2,
    "smallint_col": 2,
    "int_col": 2,
    "bigint_col": 20,
    "float_col": 2.200000047683716,
    "double_col": 20.2,
    "date_string_col": "01/03/09",
    "string_col": "2",
    "timestamp_col": "2009-01-02 23:22:00.910000",
    "year": 2009,
    "month": 1
  },
  {
    "id": 21,
    "bool_col": false,
    "tinyint_col": 1,
    "smallint_col": 1,
    "int_col": 1,
    "bigint_col": 10,
    "float_col": 1.100000023841858,
    "double_col": 10.1,
    "date_string_col": "01/03/09",
    "string_col": "1",
    "timestamp_col": "2009-01-02 23:21:00.900000",
    "year": 2009,
    "month": 1
  },
  {
    "id": 20,
    "bool_col": true,
    "tinyint_col": 0,
    "smallint_col": 0,
    "int_col": 0,
    "bigint_col": 0,
    "float_col": 0.0,
    "double_col": 0.0,
    "date_string_col": "01/03/09",
    "string_col": "0",
    "timestamp_col": "2009-01-02 23:20:00.900000",
    "year": 2009,
    "month": 1
  },
  {
    "id": 19,
    "bool_col": false,
    "tinyint_col": 9,
    "smallint_col": 9,
    "int_col": 9,
    "bigint_col": 90,
    "float_col": 9.899999618530273,
    "double_col": 90.89999999999999,
    "date_string_col": "01/02/09",
    "string_col": "9",
    "timestamp_col": "2009-01-01 23:19:00.810000",
    "year": 2009,
    "month": 1
  },
  {
    "id": 18,
    "bool_col": true,
    "tinyint_col": 8,
    "smallint_col": 8,
    "int_col": 8,
    "bigint_col": 80,
    "float_col": 8.800000190734863,
    "double_col": 80.8,
    "date_string_col": "01/02/09",
    "string_col": "8",
    "timestamp_col": "2009-01-01 23:18:00.730000",
    "year": 2009,
    "month": 1
  },
  {
    "id": 17,
    "bool_col": false,
    "tinyint_col": 7,
    "smallint_col": 7,
    "int_col": 7,
    "bigint_col": 70,
    "float_col": 7.699999809265137,
    "double_col": 70.7,
    "date_string_col": "01/02/09",
    "string_col": "7",
    "timestamp_col": "2009-01-01 23:17:00.660000",
    "year": 2009,
    "month": 1
  },
  {
    "id": 16,
    "bool_col": true,
    "tinyint_col": 6,
    "smallint_col": 6,
    "int_col": 6,
    "bigint_col": 60,
    "float_col": 6.599999904632568,
    "double_col": 60.599999999999994,
    "date_string_col": "01/02/09",
    "string_col": "6",
    "timestamp_col": "2009-01-01 23:16:00.600000",
    "year": 2009,
    "month": 1
  },
  {
    "id": 15,
    "bool_col": false,
    "tinyint_col": 5,
    "smallint_col": 5,
    "int_col": 5,
    "bigint_col": 50,
    "float_col": 5.5,
    "double_col": 50.5,
    "date_string_col": "01/02/09",
    "string_col": "5",
    "timestamp_col": "2009-01-01 23:15:00.550000",
    "year": 2009,
    "month": 1
  },
  {
    "id": 14,
    "bool_col": true,
    "tinyint_col": 4,
    "smallint_col": 4,
    "int_col": 4,
    "bigint_col": 40,
    "float_col": 4.400000095367432,
    "double_col": 40.4,
    "date_string_col": "01/02/09",
    "string_col": "4",
    "timestamp_col": "2009-01-01 23:14:00.510000",
    "year": 2009,
    "month": 1
  },
  {
    "id": 280,
    "bool_col": true,
    "tinyint_col": 0,
    "smallint_col": 0,
    "int_col": 0,
    "bigint_col": 0,
    "float_col": 0.0,
    "double_col": 0.0,
    "date_string_col": "01/29/09",
    "string_col": "0",
    "timestamp_col": "2009-01-29 03:40:12.600000",
    "year": 2009,
    "month": 1
  },
  {
    "id": 279,
    "bool_col": false,
    "tinyint_col": 9,
    "smallint_col": 9,
    "int_col": 9,
    "bigint_col": 90,
    "float_col": 9.899999618530273,
    "double_col": 90.89999999999999,
    "date_string_col": "01/28/09",
    "string_col": "9",
    "timestamp_col": "2009-01-28 03:39:12.510000",
    "year": 2009,
    "month": 1
  },
  {
    "id": 278,
    "bool_col": true,
    "tinyint_col": 8,
    "smallint_col": 8,
    "int_col": 8,
    "bigint_col": 80,
    "float_col": 8.800000190734863,
    "double_col": 80.8,
    "date_string_col": "01/28/09",
    "string_col": "8",
    "timestamp_col": "2009-01-28 03:38:12.430000",
    "year": 2009,
    "month": 1
  },
  {
    "id": 277,
    "bool_col": false,
    "tinyint_col": 7,
    "smallint_col": 7,
    "int_col": 7,
    "bigint_col": 70,
    "float_col": 7.699999809265137,
    "double_col": 70.7,
    "date_string_col": "01/28/09",
    "string_col": "7",
    "timestamp_col": "2009-01-28 03:37:12.360000",
    "year": 2009,
    "month": 1
  },
  {
    "id": 276,
    "bool_col": true,
    "tinyint_col": 6,
    "smallint_col": 6,
    "int_col": 6,
    "bigint_col": 60,
    "float_col": 6.599999904632568,
    "double_col": 60.599999999999994,
    "date_string_col": "01/28/09",
    "string_col": "6",
    "timestamp_col": "2009-01-28 03:36:12.300000",
    "year": 2009,
    "month": 1
  },
  {
    "id": 275,
    "bool_col": false,
    "tinyint_col": 5,
    "smallint_col": 5,
    "int_col": 5,
    "bigint_col": 50,
    "float_col": 5.5,
    "double_col": 50.5,
    "date_string_col": "01/28/09",
    "string_col": "5",
    "timestamp_col": "2009-01-28 03:35:12.250000",
    "year": 2009,
    "month": 1
  },
  {
    "id": 274,
    "bool_col": true,
    "tinyint_col": 4,
    "smallint_col": 4,
    "int_col": 4,
    "bigint_col": 40,
    "float_col": 4.400000095367432,
    "double_col": 40.4,
    "date_string_col": "01/28/09",
    "string_col": "4",
    "timestamp_col": "2009-01-28 03:34:12.210000",
    "year": 2009,
    "month": 1
  },
  {
    "id": 273,
    "bool_col": false,
    "tinyint_col": 3,
    "smallint_col": 3,
    "int_col": 3,
    "bigint_col": 30,
    "float_col": 3.299999952316284,
    "double_col": 30.299999999999997,
    "date_string_col": "01/28/09",
    "string_col": "3",
    "timestamp_col": "2009-01-28 03:33:12.180000",
    "year": 2009,
    "month": 1
  },
  {
    "id": 272,
    "bool_col": true,
    "tinyint_col": 2,
    "smallint_col": 2,
    "int_col": 2,
    "bigint_col": 20,
    "float_col": 2.200000047683716,
    "double_col": 20.2,
    "date_string_col": "01/28/09",
    "string_col": "2",
    "timestamp_col": "2009-01-28 03:32:12.160000",
    "year": 2009,
    "month": 1
  },
  {
    "id": 271,
    "bool_col": false,
    "tinyint_col": 1,
    "smallint_col": 1,
    "int_col": 1,
    "bigint_col": 10,
    "float_col": 1.100000023841858,
    "double_col": 10.1,
    "date_string_col": "01/28/09",
    "string_col": "1",
    "timestamp_col": "2009-01-28 03:31:12.150000",
    "year": 2009,
    "month": 1
  },
  {
    "id": 270,
    "bool_col": true,
    "tinyint_col": 0,
    "smallint_col": 0,
    "int_col": 0,
    "bigint_col": 0,
    "float_col": 0.0,
    "double_col": 0.0,
    "date_string_col": "01/28/09",
    "string_col": "0",
    "timestamp_col": "2009-01-28 03:30:12.150000",
    "year": 2009,
    "month": 1
  },
  {
    "id": 269,
    "bool_col": false,
    "tinyint_col": 9,
    "smallint_col": 9,
    "int_col": 9,
    "bigint_col": 90,
    "float_col": 9.899999618530273,
    "double_col": 90.89999999999999,
    "date_string_col": "01/27/09",
    "string_col": "9",
    "timestamp_col": "2009-01-27 03:29:12.600000",
    "year": 2009,
    "month": 1
  },
  {
    "id": 268,
    "bool_col": true,
    "tinyint_col": 8,
    "smallint_col": 8,
    "int_col": 8,
    "bigint_col": 80,
    "float_col": 8.800000190734863,
    "double_col": 80.8,
    "date_string_col": "01/27/09",
    "string_col": "8",
    "timestamp_col": "2009-01-27 03:28:11.980000",
    "year": 2009,
    "month": 1
  },
  {
    "id": 267,
    "bool_col": false,
    "tinyint_col": 7,
    "smallint_col": 7,
    "int_col": 7,
    "bigint_col": 70,
    "float_col": 7.699999809265137,
    "double_col": 70.7,
    "date_string_col": "01/27/09",
    "string_col": "7",
    "timestamp_col": "2009-01-27 03:27:11.910000",
    "year": 2009,
    "month": 1
  },
  {
    "id": 266,
    "bool_col": true,
    "tinyint_col": 6,
    "smallint_col": 6,
    "int_col": 6,
    "bigint_col": 60,
    "float_col": 6.599999904632568,
    "double_col": 60.599999999999994,
    "date_string_col": "01/27/09",
    "string_col": "6",
    "timestamp_col": "2009-01-27 03:26:11.850000",
    "year": 2009,
    "month": 1
  },
  {
    "id": 265,
    "bool_col": false,
    "tinyint_col": 5,
    "smallint_col": 5,
    "int_col": 5,
    "bigint_col": 50,
    "float_col": 5.5,
    "double_col": 50.5,
    "date_string_col": "01/27/09",
    "string_col": "5",
    "timestamp_col": "2009-01-27 03:25:11.800000",
    "year": 2009,
    "month": 1
  },
  {
    "id": 264,
    "bool_col": true,
    "tinyint_col": 4,
    "smallint_col": 4,
    "int_col": 4,
    "bigint_col": 40,
    "float_col": 4.400000095367432,
    "double_col": 40.4,
    "date_string_col": "01/27/09",
    "string_col": "4",
    "timestamp_col": "2009-01-27 03:24:11.760000",
    "year": 2009,
    "month": 1
  },
  {
    "id": 263,
    "bool_col": false,
    "tinyint_col": 3,
    "smallint_col": 3,
    "int_col": 3,
    "bigint_col": 30,
    "float_col": 3.299999952316284,
    "double_col": 30.299999999999997,
    "date_string_col": "01/27/09",
    "string_col": "3",
    "timestamp_col": "2009-01-27 03:23:11.730000",
    "year": 2009,
    "month": 1
  },
  {
    "id": 262,
    "bool_col": true,
    "tinyint_col": 2,
    "smallint_col": 2,
    "int_col": 2,
    "bigint_col": 20,
    "float_col": 2.200000047683716,
    "double_col": 20.2,
    "date_string_col": "01/27/09",
    "string_col": "2",
    "timestamp_col": "2009-01-27 03:22:11.710000",
    "year": 2009,
    "month": 1
  },
  {
    "id": 261,
    "bool_col": false,
    "tinyint_col": 1,
    "smallint_col": 1,
    "int_col": 1,
    "bigint_col": 10,
    "float_col": 1.100000023841858,
    "double_col": 10.1,
    "date_string_col": "01/27/09",
    "string_col": "1",
    "timestamp_col": "2009-01-27 03:21:11.700000",
    "year": 2009,
    "month": 1
  },
  {
    "id": 260,
    "bool_col": true,
    "tinyint_col": 0,
    "smallint_col": 0,
    "int_col": 0,
    "bigint_col": 0,
    "float_col": 0.0,
    "double_col": 0.0,
    "date_string_col": "01/27/09",
    "string_col": "0",
    "timestamp_col": "2009-01-27 03:20:11.700000",
    "year": 2009,
    "month": 1
  },
  {
    "id": 259,
    "bool_col": false,
    "tinyint_col": 9,
    "smallint_col": 9,
    "int_col": 9,
    "bigint_col": 90,
    "float_col": 9.899999618530273,
    "double_col": 90.89999999999999,
    "date_string_col": "01/26/09",
    "string_col": "9",
    "timestamp_col": "2009-01-26 03:19:11.610000",
    "year": 2009,
    "month": 1
  },
  {
    "id": 258,
    "bool_col": true,
    "tinyint_col": 8,
    "smallint_col": 8,
    "int_col": 8,
    "bigint_col": 80,
    "float_col": 8.800000190734863,
    "double_col": 80.8,
    "date_string_col": "01/26/09",
    "string_col": "8",
    "timestamp_col": "2009-01-26 03:18:11.530000",
    "year": 2009,
    "month": 1
  },
  {
    "id": 257,
    "bool_col": false,
    "tinyint_col": 7,
    "smallint_col": 7,
    "int_col": 7,
    "bigint_col": 70,
    "float_col": 7.699999809265137,
    "double_col": 70.7,
    "date_string_col": "01/26/09",
    "string_col": "7",
    "timestamp_col": "2009-01-26 03:17:11.460000",
    "year": 2009,
    "month": 1
  },
  {
    "id": 256,
    "bool_col": true,
    "tinyint_col": 6,
    "smallint_col": 6,
    "int_col": 6,
    "bigint_col": 60,
    "float_col": 6.599999904632568,
    "double_col": 60.599999999999994,
    "date_string_col": "01/26/09",
    "string_col": "6",
    "timestamp_col": "2009-01-26 03:16:11.400000",
    "year": 2009,
    "month": 1
  },
  {
    "id": 255,
    "bool_col": false,
    "tinyint_col": 5,
    "smallint_col": 5,
    "int_col": 5,
    "bigint_col": 50,
    "float_col": 5.5,
    "double_col": 50.5,
    "date_string_col": "01/26/09",
    "string_col": "5",
    "timestamp_col": "2009-01-26 03:15:11.350000",
    "year": 2009,
    "month": 1
  },
  {
    "id": 254,
    "bool_col": true,
    "tinyint_col": 4,
    "smallint_col": 4,
    "int_col": 4,
    "bigint_col": 40,
    "float_col": 4.400000095367432,
    "double_col": 40.4,
    "date_string_col": "01/26/09",
    "string_col": "4",
    "timestamp_col": "2009-01-26 03:14:11.310000",
    "year": 2009,
    "month": 1
  },
  {
    "id": 253,
    "bool_col": false,
    "tinyint_col": 3,
    "smallint_col": 3,
    "int_col": 3,
    "bigint_col": 30,
    "float_col": 3.299999952316284,
    "double_col": 30.299999999999997,
    "date_string_col": "01/26/09",
    "string_col": "3",
    "timestamp_col": "2009-01-26 03:13:11.280000",
    "year": 2009,
    "month": 1
  },
  {
    "id": 309,
    "bool_col": false,
    "tinyint_col": 9,
    "smallint_col": 9,
    "int_col": 9,
    "bigint_col": 90,
    "float_col": 9.899999618530273,
    "double_col": 90.89999999999999,
    "date_string_col": "01/31/09",
    "string_col": "9",
    "timestamp_col": "2009-01-31 04:09:13.860000",
    "year": 2009,
    "month": 1
  },
  {
    "id": 308,
    "bool_col": true,
    "tinyint_col": 8,
    "smallint_col": 8,
    "int_col": 8,
    "bigint_col": 80,
    "float_col": 8.800000190734863,
    "double_col": 80.8,
    "date_string_col": "01/31/09",
    "string_col": "8",
    "timestamp_col": "2009-01-31 04:08:13.780000",
    "year": 2009,
    "month": 1
  },
  {
    "id": 307,
    "bool_col": false,
    "tinyint_col": 7,
    "smallint_col": 7,
    "int_col": 7,
    "bigint_col": 70,
    "float_col": 7.699999809265137,
    "double_col": 70.7,
    "date_string_col": "01/31/09",
    "string_col": "7",
    "timestamp_col": "2009-01-31 04:07:13.710000",
    "year": 2009,
    "month": 1
  },
  {
    "id": 306,
    "bool_col": true,
    "tinyint_col": 6,
    "smallint_col": 6,
    "int_col": 6,
    "bigint_col": 60,
    "float_col": 6.599999904632568,
    "double_col": 60.599999999999994,
    "date_string_col": "01/31/09",
    "string_col": "6",
    "timestamp_col": "2009-01-31 04:06:13.650000",
    "year": 2009,
    "month": 1
  },
  {
    "id": 305,
    "bool_col": false,
    "tinyint_col": 5,
    "smallint_col": 5,
    "int_col": 5,
    "bigint_col": 50,
    "float_col": 5.5,
    "double_col": 50.5,
    "date_string_col": "01/31/09",
    "string_col": "5",
    "timestamp_col": "2009-01-31 04:05:13.600000",
    "year": 2009,
    "month": 1
  },
  {
    "id": 304,
    "bool_col": true,
    "tinyint_col": 4,
    "smallint_col": 4,
    "int_col": 4,
    "bigint_col": 40,
    "float_col": 4.400000095367432,
    "double_col": 40.4,
    "date_string_col": "01/31/09",
    "string_col": "4",
    "timestamp_col": "2009-01-31 04:04:13.560000",
    "year": 2009,
    "month": 1
  },
  {
    "id": 303,
    "bool_col": false,
    "tinyint_col": 3,
    "smallint_col": 3,
    "int_col": 3,
    "bigint_col": 30,
    "float_col": 3.299999952316284,
    "double_col": 30.299999999999997,
    "date_string_col": "01/31/09",
    "string_col": "3",
    "timestamp_col": "2009-01-31 04:03:13.530000",
    "year": 2009,
    "month": 1
  },
  {
    "id": 302,
    "bool_col": true,
    "tinyint_col": 2,
    "smallint_col": 2,
    "int_col": 2,
    "bigint_col": 20,
    "float_col": 2.200000047683716,
    "double_col": 20.2,
    "date_string_col": "01/31/09",
    "string_col": "2",
    "timestamp_col": "2009-01-31 04:02:13.510000",
    "year": 2009,
    "month": 1
  },
  {
    "id": 301,
    "bool_col": false,
    "tinyint_col": 1,
    "smallint_col": 1,
    "int_col": 1,
    "bigint_col": 10,
    "float_col": 1.100000023841858,
    "double_col": 10.1,
    "date_string_col": "01/31/09",
    "string_col": "1",
    "timestamp_col": "2009-01-31 04:01:13.500000",
    "year": 2009,
    "month": 1
  },
  {
    "id": 300,
    "bool_col": true,
    "tinyint_col": 0,
    "smallint_col": 0,
    "int_col": 0,
    "bigint_col": 0,
    "float_col": 0.0,
    "double_col": 0.0,
    "date_string_col": "01/31/09",
    "string_col": "0",
    "timestamp_col": "2009-01-31 04:00:13.500000",
    "year": 2009,
    "month": 1
  },
  {
    "id": 299,
    "bool_col": false,
    "tinyint_col": 9,
    "smallint_col": 9,
    "int_col": 9,
    "bigint_col": 90,
    "float_col": 9.899999618530273,
    "double_col": 90.89999999999999,
    "date_string_col": "01/30/09",
    "string_col": "9",
    "timestamp_col": "2009-01-30 03:59:13.410000",
    "year": 2009,
    "month": 1
  },
  {
    "id": 298,
    "bool_col": true,
    "tinyint_col": 8,
    "smallint_col": 8,
    "int_col": 8,
    "bigint_col": 80,
    "float_col": 8.800000190734863,
    "double_col": 80.8,
    "date_string_col": "01/30/09",
    "string_col": "8",
    "timestamp_col": "2009-01-30 03:58:13.330000",
    "year": 2009,
    "month": 1
  },
  {
    "id": 297,
    "bool_col": false,
    "tinyint_col": 7,
    "smallint_col": 7,
    "int_col": 7,
    "bigint_col": 70,
    "float_col": 7.699999809265137,
    "double_col": 70.7,
    "date_string_col": "01/30/09",
    "string_col": "7",
    "timestamp_col": "2009-01-30 03:57:13.260000",
    "year": 2009,
    "month": 1
  },
  {
    "id": 296,
    "bool_col": true,
    "tinyint_col": 6,
    "smallint_col": 6,
    "int_col": 6,
    "bigint_col": 60,
    "float_col": 6.599999904632568,
    "double_col": 60.599999999999994,
    "date_string_col": "01/30/09",
    "string_col": "6",
    "timestamp_col": "2009-01-30 03:56:13.200000",
    "year": 2009,
    "month": 1
  },
  {
    "id": 295,
    "bool_col": false,
    "tinyint_col": 5,
    "smallint_col": 5,
    "int_col": 5,
    "bigint_col": 50,
    "float_col": 5.5,
    "double_col": 50.5,
    "date_string_col": "01/30/09",
    "string_col": "5",
    "timestamp_col": "2009-01-30 03:55:13.150000",
    "year": 2009,
    "month": 1
  },
  {
    "id": 294,
    "bool_col": true,
    "tinyint_col": 4,
    "smallint_col": 4,
    "int_col": 4,
    "bigint_col": 40,
    "float_col": 4.400000095367432,
    "double_col": 40.4,
    "date_string_col": "01/30/09",
    "string_col": "4",
    "timestamp_col": "2009-01-30 03:54:13.110000",
    "year": 2009,
    "month": 1
  },
  {
    "id": 293,
    "bool_col": false,
    "tinyint_col": 3,
    "smallint_col": 3,
    "int_col": 3,
    "bigint_col": 30,
    "float_col": 3.299999952316284,
    "double_col": 30.299999999999997,
    "date_string_col": "01/30/09",
    "string_col": "3",
    "timestamp_col": "2009-01-30 03:53:13.800000",
    "year": 2009,
    "month": 1
  },
  {
    "id": 292,
    "bool_col": true,
    "tinyint_col": 2,
    "smallint_col": 2,
    "int_col": 2,
    "bigint_col": 20,
    "float_col": 2.200000047683716,
    "double_col": 20.2,
    "date_string_col": "01/30/09",
    "string_col": "2",
    "timestamp_col": "2009-01-30 03:52:13.600000",
    "year": 2009,
    "month": 1
  },
  {
    "id": 291,
    "bool_col": false,
    "tinyint_col": 1,
    "smallint_col": 1,
    "int_col": 1,
    "bigint_col": 10,
    "float_col": 1.100000023841858,
    "double_col": 10.1,
    "date_string_col": "01/30/09",
    "string_col": "1",
    "timestamp_col": "2009-01-30 03:51:13.500000",
    "year": 2009,
    "month": 1
  },
  {
    "id": 290,
    "bool_col": true,
    "tinyint_col": 0,
    "smallint_col": 0,
    "int_col": 0,
    "bigint_col": 0,
    "float_col": 0.0,
    "double_col": 0.0,
    "date_string_col": "01/30/09",
    "string_col": "0",
    "timestamp_col": "2009-01-30 03:50:13.500000",
    "year": 2009,
    "month": 1
  },
  {
    "id": 289,
    "bool_col": false,
    "tinyint_col": 9,
    "smallint_col": 9,
    "int_col": 9,
    "bigint_col": 90,
    "float_col": 9.899999618530273,
    "double_col": 90.89999999999999,
    "date_string_col": "01/29/09",
    "string_col": "9",
    "timestamp_col": "2009-01-29 03:49:12.960000",
    "year": 2009,
    "month": 1
  },
  {
    "id": 288,
    "bool_col": true,
    "tinyint_col": 8,
    "smallint_col": 8,
    "int_col": 8,
    "bigint_col": 80,
    "float_col": 8.800000190734863,
    "double_col": 80.8,
    "date_string_col": "01/29/09",
    "string_col": "8",
    "timestamp_col": "2009-01-29 03:48:12.880000",
    "year": 2009,
    "month": 1
  },
  {
    "id": 287,
    "bool_col": false,
    "tinyint_col": 7,
    "smallint_col": 7,
    "int_col": 7,
    "bigint_col": 70,
    "float_col": 7.699999809265137,
    "double_col": 70.7,
    "date_string_col": "01/29/09",
    "string_col": "7",
    "timestamp_col": "2009-01-29 03:47:12.810000",
    "year": 2009,
    "month": 1
  },
  {
    "id": 286,
    "bool_col": true,
    "tinyint_col": 6,
    "smallint_col": 6,
    "int_col": 6,
    "bigint_col": 60,
    "float_col": 6.599999904632568,
    "double_col": 60.599999999999994,
    "date_string_col": "01/29/09",
    "string_col": "6",
    "timestamp_col": "2009-01-29 03:46:12.750000",
    "year": 2009,
    "month": 1
  },
  {
    "id": 285,
    "bool_col": false,
    "tinyint_col": 5,
    "smallint_col": 5,
    "int_col": 5,
    "bigint_col": 50,
    "float_col": 5.5,
    "double_col": 50.5,
    "date_string_col": "01/29/09",
    "string_col": "5",
    "timestamp_col": "2009-01-29 03:45:12.700000",
    "year": 2009,
    "month": 1
  },
  {
    "id": 284,
    "bool_col": true,
    "tinyint_col": 4,
    "smallint_col": 4,
    "int_col": 4,
    "bigint_col": 40,
    "float_col": 4.400000095367432,
    "double_col": 40.4,
    "date_string_col": "01/29/09",
    "string_col": "4",
    "timestamp_col": "2009-01-29 03:44:12.660000",
    "year": 2009,
    "month": 1
  },
  {
    "id": 283,
    "bool_col": false,
    "tinyint_col": 3,
    "smallint_col": 3,
    "int_col": 3,
    "bigint_col": 30,
    "float_col": 3.299999952316284,
    "double_col": 30.299999999999997,
    "date_string_col": "01/29/09",
    "string_col": "3",
    "timestamp_col": "2009-01-29 03:43:12.630000",
    "year": 2009,
    "month": 1
  },
  {
    "id": 282,
    "bool_col": true,
    "tinyint_col": 2,
    "smallint_col": 2,
    "int_col": 2,
    "bigint_col": 20,
    "float_col": 2.200000047683716,
    "double_col": 20.2,
    "date_string_col": "01/29/09",
    "string_col": "2",
    "timestamp_col": "2009-01-29 03:42:12.610000",
    "year": 2009,
    "month": 1
  },
  {
    "id": 281,
    "bool_col": false,
    "tinyint_col": 1,
    "smallint_col": 1,
    "int_col": 1,
    "bigint_col": 10,
    "float_col": 1.100000023841858,
    "double_col": 10.1,
    "date_string_col": "01/29/09",
    "string_col": "1",
    "timestamp_col": "2009-01-29 03:41:12.600000",
    "year": 2009,
    "month": 1
  },
  {
    "id": 223,
    "bool_col": false,
    "tinyint_col": 3,
    "smallint_col": 3,
    "int_col": 3,
    "bigint_col": 30,
    "float_col": 3.299999952316284,
    "double_col": 30.299999999999997,
    "date_string_col": "01/23/09",
    "string_col": "3",
    "timestamp_col": "2009-01-23 02:43:09.930000",
    "year": 2009,
    "month": 1
  },
  {
    "id": 222,
    "bool_col": true,
    "tinyint_col": 2,
    "smallint_col": 2,
    "int_col": 2,
    "bigint_col": 20,
    "float_col": 2.200000047683716,
    "double_col": 20.2,
    "date_string_col": "01/23/09",
    "string_col": "2",
    "timestamp_col": "2009-01-23 02:42:09.910000",
    "year": 2009,
    "month": 1
  },
  {
    "id": 221,
    "bool_col": false,
    "tinyint_col": 1,
    "smallint_col": 1,
    "int_col": 1,
    "bigint_col": 10,
    "float_col": 1.100000023841858,
    "double_col": 10.1,
    "date_string_col": "01/23/09",
    "string_col": "1",
    "timestamp_col": "2009-01-23 02:41:09.900000",
    "year": 2009,
    "month": 1
  },
  {
    "id": 220,
    "bool_col": true,
    "tinyint_col": 0,
    "smallint_col": 0,
    "int_col": 0,
    "bigint_col": 0,
    "float_col": 0.0,
    "double_col": 0.0,
    "date_string_col": "01/23/09",
    "string_col": "0",
    "timestamp_col": "2009-01-23 02:40:09.900000",
    "year": 2009,
    "month": 1
  },
  {
    "id": 219,
    "bool_col": false,
    "tinyint_col": 9,
    "smallint_col": 9,
    "int_col": 9,
    "bigint_col": 90,
    "float_col": 9.899999618530273,
    "double_col": 90.89999999999999,
    "date_string_col": "01/22/09",
    "string_col": "9",
    "timestamp_col": "2009-01-22 02:39:09.810000",
    "year": 2009,
    "month": 1
  },
  {
    "id": 218,
    "bool_col": true,
    "tinyint_col": 8,
    "smallint_col": 8,
    "int_col": 8,
    "bigint_col": 80,
    "float_col": 8.800000190734863,
    "double_col": 80.8,
    "date_string_col": "01/22/09",
    "string_col": "8",
    "timestamp_col": "2009-01-22 02:38:09.730000",
    "year": 2009,
    "month": 1
  },
  {
    "id": 217,
    "bool_col": false,
    "tinyint_col": 7,
    "smallint_col": 7,
    "int_col": 7,
    "bigint_col": 70,
    "float_col": 7.699999809265137,
    "double_col": 70.7,
    "date_string_col": "01/22/09",
    "string_col": "7",
    "timestamp_col": "2009-01-22 02:37:09.660000",
    "year": 2009,
    "month": 1
  },
  {
    "id": 216,
    "bool_col": true,
    "tinyint_col": 6,
    "smallint_col": 6,
    "int_col": 6,
    "bigint_col": 60,
    "float_col": 6.599999904632568,
    "double_col": 60.599999999999994,
    "date_string_col": "01/22/09",
    "string_col": "6",
    "timestamp_col": "2009-01-22 02:36:09.600000",
    "year": 2009,
    "month": 1
  },
  {
    "id": 215,
    "bool_col": false,
    "tinyint_col": 5,
    "smallint_col": 5,
    "int_col": 5,
    "bigint_col": 50,
    "float_col": 5.5,
    "double_col": 50.5,
    "date_string_col": "01/22/09",
    "string_col": "5",
    "timestamp_col": "2009-01-22 02:35:09.550000",
    "year": 2009,
    "month": 1
  },
  {
    "id": 214,
    "bool_col": true,
    "tinyint_col": 4,
    "smallint_col": 4,
    "int_col": 4,
    "bigint_col": 40,
    "float_col": 4.400000095367432,
    "double_col": 40.4,
    "date_string_col": "01/22/09",
    "string_col": "4",
    "timestamp_col": "2009-01-22 02:34:09.510000",
    "year": 2009,
    "month": 1
  },
  {
    "id": 213,
    "bool_col": false,
    "tinyint_col": 3,
    "smallint_col": 3,
    "int_col": 3,
    "bigint_col": 30,
    "float_col": 3.299999952316284,
    "double_col": 30.299999999999997,
    "date_string_col": "01/22/09",
    "string_col": "3",
    "timestamp_col": "2009-01-22 02:33:09.480000",
    "year": 2009,
    "month": 1
  },
  {
    "id": 212,
    "bool_col": true,
    "tinyint_col": 2,
    "smallint_col": 2,
    "int_col": 2,
    "bigint_col": 20,
    "float_col": 2.200000047683716,
    "double_col": 20.2,
    "date_string_col": "01/22/09",
    "string_col": "2",
    "timestamp_col": "2009-01-22 02:32:09.460000",
    "year": 2009,
    "month": 1
  },
  {
    "id": 211,
    "bool_col": false,
    "tinyint_col": 1,
    "smallint_col": 1,
    "int_col": 1,
    "bigint_col": 10,
    "float_col": 1.100000023841858,
    "double_col": 10.1,
    "date_string_col": "01/22/09",
    "string_col": "1",
    "timestamp_col": "2009-01-22 02:31:09.450000",
    "year": 2009,
    "month": 1
  },
  {
    "id": 210,
    "bool_col": true,
    "tinyint_col": 0,
    "smallint_col": 0,
    "int_col": 0,
    "bigint_col": 0,
    "float_col": 0.0,
    "double_col": 0.0,
    "date_string_col": "01/22/09",
    "string_col": "0",
    "timestamp_col": "2009-01-22 02:30:09.450000",
    "year": 2009,
    "month": 1
  },
  {
    "id": 209,
    "bool_col": false,
    "tinyint_col": 9,
    "smallint_col": 9,
    "int_col": 9,
    "bigint_col": 90,
    "float_col": 9.899999618530273,
    "double_col": 90.89999999999999,
    "date_string_col": "01/21/09",
    "string_col": "9",
    "timestamp_col": "2009-01-21 02:29:09.360000",
    "year": 2009,
    "month": 1
  },
  {
    "id": 208,
    "bool_col": true,
    "tinyint_col": 8,
    "smallint_col": 8,
    "int_col": 8,
    "bigint_col": 80,
    "float_col": 8.800000190734863,
    "double_col": 80.8,
    "date_string_col": "01/21/09",
    "string_col": "8",
    "timestamp_col": "2009-01-21 02:28:09.280000",
    "year": 2009,
    "month": 1
  },
  {
    "id": 207,
    "bool_col": false,
    "tinyint_col": 7,
    "smallint_col": 7,
    "int_col": 7,
    "bigint_col": 70,
    "float_col": 7.699999809265137,
    "double_col": 70.7,
    "date_string_col": "01/21/09",
    "string_col": "7",
    "timestamp_col": "2009-01-21 02:27:09.210000",
    "year": 2009,
    "month": 1
  },
  {
    "id": 206,
    "bool_col": true,
    "tinyint_col": 6,
    "smallint_col": 6,
    "int_col": 6,
    "bigint_col": 60,
    "float_col": 6.599999904632568,
    "double_col": 60.599999999999994,
    "date_string_col": "01/21/09",
    "string_col": "6",
    "timestamp_col": "2009-01-21 02:26:09.150000",
    "year": 2009,
    "month": 1
  },
  {
    "id": 205,
    "bool_col": false,
    "tinyint_col": 5,
    "smallint_col": 5,
    "int_col": 5,
    "bigint_col": 50,
    "float_col": 5.5,
    "double_col": 50.5,
    "date_string_col": "01/21/09",
    "string_col": "5",
    "timestamp_col": "2009-01-21 02:25:09.100000",
    "year": 2009,
    "month": 1
  },
  {
    "id": 204,
    "bool_col": true,
    "tinyint_col": 4,
    "smallint_col": 4,
    "int_col": 4,
    "bigint_col": 40,
    "float_col": 4.400000095367432,
    "double_col": 40.4,
    "date_string_col": "01/21/09",
    "string_col": "4",
    "timestamp_col": "2009-01-21 02:24:09.600000",
    "year": 2009,
    "month": 1
  },
  {
    "id": 203,
    "bool_col": false,
    "tinyint_col": 3,
    "smallint_col": 3,
    "int_col": 3,
    "bigint_col": 30,
    "float_col": 3.299999952316284,
    "double_col": 30.299999999999997,
    "date_string_col": "01/21/09",
    "string_col": "3",
    "timestamp_col": "2009-01-21 02:23:09.300000",
    "year": 2009,
    "month": 1
  },
  {
    "id": 202,
    "bool_col": true,
    "tinyint_col": 2,
    "smallint_col": 2,
    "int_col": 2,
    "bigint_col": 20,
    "float_col": 2.200000047683716,
    "double_col": 20.2,
    "date_string_col": "01/21/09",
    "string_col": "2",
    "timestamp_col": "2009-01-21 02:22:09.100000",
    "year": 2009,
    "month": 1
  },
  {
    "id": 201,
    "bool_col": false,
    "tinyint_col": 1,
    "smallint_col": 1,
    "int_col": 1,
    "bigint_col": 10,
    "float_col": 1.100000023841858,
    "double_col": 10.1,
    "date_string_col": "01/21/09",
    "string_col": "1",
    "timestamp_col": "2009-01-21 02:21:09",
    "year": 2009,
    "month": 1
  },
  {
    "id": 200,
    "bool_col": true,
    "tinyint_col": 0,
    "smallint_col": 0,
    "int_col": 0,
    "bigint_col": 0,
    "float_col": 0.0,
    "double_col": 0.0,
    "date_string_col": "01/21/09",
    "string_col": "0",
    "timestamp_col": "2009-01-21 02:20:09",
    "year": 2009,
    "month": 1
  },
  {
    "id": 199,
    "bool_col": false,
    "tinyint_col": 9,
    "smallint_col": 9,
    "int_col": 9,
    "bigint_col": 90,
    "float_col": 9.899999618530273,
    "double_col": 90.89999999999999,
    "date_string_col": "01/20/09",
    "string_col": "9",
    "timestamp_col": "2009-01-20 02:19:08.910000",
    "year": 2009,
    "month": 1
  },
  {
    "id": 198,
    "bool_col": true,
    "tinyint_col": 8,
    "smallint_col": 8,
    "int_col": 8,
    "bigint_col": 80,
    "float_col": 8.800000190734863,
    "double_col": 80.8,
    "date_string_col": "01/20/09",
    "string_col": "8",
    "timestamp_col": "2009-01-20 02:18:08.830000",
    "year": 2009,
    "month": 1
  },
  {
    "id": 197,
    "bool_col": false,
    "tinyint_col": 7,
    "smallint_col": 7,
    "int_col": 7,
    "bigint_col": 70,
    "float_col": 7.699999809265137,
    "double_col": 70.7,
    "date_string_col": "01/20/09",
    "string_col": "7",
    "timestamp_col": "2009-01-20 02:17:08.760000",
    "year": 2009,
    "month": 1
  },
  {
    "id": 196,
    "bool_col": true,
    "tinyint_col": 6,
    "smallint_col": 6,
    "int_col": 6,
    "bigint_col": 60,
    "float_col": 6.599999904632568,
    "double_col": 60.599999999999994,
    "date_string_col": "01/20/09",
    "string_col": "6",
    "timestamp_col": "2009-01-20 02:16:08.700000",
    "year": 2009,
    "month": 1
  },
  {
    "id": 195,
    "bool_col": false,
    "tinyint_col": 5,
    "smallint_col": 5,
    "int_col": 5,
    "bigint_col": 50,
    "float_col": 5.5,
    "double_col": 50.5,
    "date_string_col": "01/20/09",
    "string_col": "5",
    "timestamp_col": "2009-01-20 02:15:08.650000",
    "year": 2009,
    "month": 1
  },
  {
    "id": 252,
    "bool_col": true,
    "tinyint_col": 2,
    "smallint_col": 2,
    "int_col": 2,
    "bigint_col": 20,
    "float_col": 2.200000047683716,
    "double_col": 20.2,
    "date_string_col": "01/26/09",
    "string_col": "2",
    "timestamp_col": "2009-01-26 03:12:11.260000",
    "year": 2009,
    "month": 1
  },
  {
    "id": 251,
    "bool_col": false,
    "tinyint_col": 1,
    "smallint_col": 1,
    "int_col": 1,
    "bigint_col": 10,
    "float_col": 1.100000023841858,
    "double_col": 10.1,
    "date_string_col": "01/26/09",
    "string_col": "1",
    "timestamp_col": "2009-01-26 03:11:11.250000",
    "year": 2009,
    "month": 1
  },
  {
    "id": 250,
    "bool_col": true,
    "tinyint_col": 0,
    "smallint_col": 0,
    "int_col": 0,
    "bigint_col": 0,
    "float_col": 0.0,
    "double_col": 0.0,
    "date_string_col": "01/26/09",
    "string_col": "0",
    "timestamp_col": "2009-01-26 03:10:11.250000",
    "year": 2009,
    "month": 1
  },
  {
    "id": 249,
    "bool_col": false,
    "tinyint_col": 9,
    "smallint_col": 9,
    "int_col": 9,
    "bigint_col": 90,
    "float_col": 9.899999618530273,
    "double_col": 90.89999999999999,
    "date_string_col": "01/25/09",
    "string_col": "9",
    "timestamp_col": "2009-01-25 03:09:11.160000",
    "year": 2009,
    "month": 1
  },
  {
    "id": 248,
    "bool_col": true,
    "tinyint_col": 8,
    "smallint_col": 8,
    "int_col": 8,
    "bigint_col": 80,
    "float_col": 8.800000190734863,
    "double_col": 80.8,
    "date_string_col": "01/25/09",
    "string_col": "8",
    "timestamp_col": "2009-01-25 03:08:11.800000",
    "year": 2009,
    "month": 1
  },
  {
    "id": 247,
    "bool_col": false,
    "tinyint_col": 7,
    "smallint_col": 7,
    "int_col": 7,
    "bigint_col": 70,
    "float_col": 7.699999809265137,
    "double_col": 70.7,
    "date_string_col": "01/25/09",
    "string_col": "7",
    "timestamp_col": "2009-01-25 03:07:11.100000",
    "year": 2009,
    "month": 1
  },
  {
    "id": 246,
    "bool_col": true,
    "tinyint_col": 6,
    "smallint_col": 6,
    "int_col": 6,
    "bigint_col": 60,
    "float_col": 6.599999904632568,
    "double_col": 60.599999999999994,
    "date_string_col": "01/25/09",
    "string_col": "6",
    "timestamp_col": "2009-01-25 03:06:10.950000",
    "year": 2009,
    "month": 1
  },
  {
    "id": 245,
    "bool_col": false,
    "tinyint_col": 5,
    "smallint_col": 5,
    "int_col": 5,
    "bigint_col": 50,
    "float_col": 5.5,
    "double_col": 50.5,
    "date_string_col": "01/25/09",
    "string_col": "5",
    "timestamp_col": "2009-01-25 03:05:10.900000",
    "year": 2009,
    "month": 1
  },
  {
    "id": 244,
    "bool_col": true,
    "tinyint_col": 4,
    "smallint_col": 4,
    "int_col": 4,
    "bigint_col": 40,
    "float_col": 4.400000095367432,
    "double_col": 40.4,
    "date_string_col": "01/25/09",
    "string_col": "4",
    "timestamp_col": "2009-01-25 03:04:10.860000",
    "year": 2009,
    "month": 1
  },
  {
    "id": 243,
    "bool_col": false,
    "tinyint_col": 3,
    "smallint_col": 3,
    "int_col": 3,
    "bigint_col": 30,
    "float_col": 3.299999952316284,
    "double_col": 30.299999999999997,
    "date_string_col": "01/25/09",
    "string_col": "3",
    "timestamp_col": "2009-01-25 03:03:10.830000",
    "year": 2009,
    "month": 1
  },
  {
    "id": 242,
    "bool_col": true,
    "tinyint_col": 2,
    "smallint_col": 2,
    "int_col": 2,
    "bigint_col": 20,
    "float_col": 2.200000047683716,
    "double_col": 20.2,
    "date_string_col": "01/25/09",
    "string_col": "2",
    "timestamp_col": "2009-01-25 03:02:10.810000",
    "year": 2009,
    "month": 1
  },
  {
    "id": 241,
    "bool_col": false,
    "tinyint_col": 1,
    "smallint_col": 1,
    "int_col": 1,
    "bigint_col": 10,
    "float_col": 1.100000023841858,
    "double_col": 10.1,
    "date_string_col": "01/25/09",
    "string_col": "1",
    "timestamp_col": "2009-01-25 03:01:10.800000",
    "year": 2009,
    "month": 1
  },
  {
    "id": 240,
    "bool_col": true,
    "tinyint_col": 0,
    "smallint_col": 0,
    "int_col": 0,
    "bigint_col": 0,
    "float_col": 0.0,
    "double_col": 0.0,
    "date_string_col": "01/25/09",
    "string_col": "0",
    "timestamp_col": "2009-01-25 03:00:10.800000",
    "year": 2009,
    "month": 1
  },
  {
    "id": 239,
    "bool_col": false,
    "tinyint_col": 9,
    "smallint_col": 9,
    "int_col": 9,
    "bigint_col": 90,
    "float_col": 9.899999618530273,
    "double_col": 90.89999999999999,
    "date_string_col": "01/24/09",
    "string_col": "9",
    "timestamp_col": "2009-01-24 02:59:10.710000",
    "year": 2009,
    "month": 1
  },
  {
    "id": 224,
    "bool_col": true,
    "tinyint_col": 4,
    "smallint_col": 4,
    "int_col": 4,
    "bigint_col": 40,
    "float_col": 4.400000095367432,
    "double_col": 40.4,
    "date_string_col": "01/23/09",
    "string_col": "4",
    "timestamp_col": "2009-01-23 02:44:09.960000",
    "year": 2009,
    "month": 1
  },
  {
    "id": 225,
    "bool_col": false,
    "tinyint_col": 5,
    "smallint_col": 5,
    "int_col": 5,
    "bigint_col": 50,
    "float_col": 5.5,
    "double_col": 50.5,
    "date_string_col": "01/23/09",
    "string_col": "5",
    "timestamp_col": "2009-01-23 02:45:10",
    "year": 2009,
    "month": 1
  },
  {
    "id": 226,
    "bool_col": true,
    "tinyint_col": 6,
    "smallint_col": 6,
    "int_col": 6,
    "bigint_col": 60,
    "float_col": 6.599999904632568,
    "double_col": 60.599999999999994,
    "date_string_col": "01/23/09",
    "string_col": "6",
    "timestamp_col": "2009-01-23 02:46:10.500000",
    "year": 2009,
    "month": 1
  },
  {
    "id": 227,
    "bool_col": false,
    "tinyint_col": 7,
    "smallint_col": 7,
    "int_col": 7,
    "bigint_col": 70,
    "float_col": 7.699999809265137,
    "double_col": 70.7,
    "date_string_col": "01/23/09",
    "string_col": "7",
    "timestamp_col": "2009-01-23 02:47:10.110000",
    "year": 2009,
    "month": 1
  },
  {
    "id": 228,
    "bool_col": true,
    "tinyint_col": 8,
    "smallint_col": 8,
    "int_col": 8,
